"","review","score"
"852","Although not every part of That Dragon, Cancer works, it’s a crushingly intimate game that left me thankful for the people who are still in my life, and reflective on those who are not. I’m so grateful to the Greens for sharing their experience.",1
"853","Although its clunky controls and inconsistent voice acting dates Heavy Rain, it still remains enjoyable (if mad) B-grade sholock. A stunning visual upgrade on the PlayStation 4 makes this the version to grab if you’re new to developer Quantic Dream’s games, and existing fans should find enjoyment in a richer aesthetic this time around.",1
"854","Don't overlook Worms WMD. These cute-looking creatures are big fun on the battlefield.",1
"855","Offworld Trading Company is fast-paced economic warfare with some clever capitalistic mind games to play with.",1
"856","The colorful settings, beautiful soundtrack, and basic controls made it a great experience that constantly piqued my interest, even if it never challenged me to master it other than deciphering its cryptic environmental clues. Instead, Abzu relishes in giving you freedom to simply enjoy exploring the fascinating deep blue sea.",1
"857","There's a massive amount of content in Call of Duty: Infinite Warfare, though especially if you played Black Ops 3 last year there’s little of it that’s particularly impressive.",1
"858","It sports a wonderful, diverse cast of characters, places a clear emphasis on strong fundamental play, it gives competitive players a great online experience, and it does it all while looking gorgeous. Strictly in terms of mechanics and competitive features, Street Fighter 5 is just about peerless, but it has quite a ways to go before it stacks up against other fighting games - including its own predecessor - in terms of overall content.",1
"859","Quantum Break is an artistically distinct shooter, with a compelling and malleable plot and excellent performances from its main players in both their digital and live-action forms. While I wish more thought had gone into maintaining the thrill of discovering its time-twisting powers from start to finish, it ultimately didn’t prevent me from thoroughly enjoying Quantum Break’s 10-hour campaign, two times over.",1
"860","Most importantly, the hockey presented on the ice is dynamic and fluid, and it serves up an excellent version of the fastest game around.",1
"861","Chronos is a challenging puzzle/action-adventure, and one of the richest experiences available on Oculus Rift yet.",1
"862","There's a massive amount of content in Call of Duty: Infinite Warfare, though especially if you played Black Ops 3 last year there’s little of it that’s particularly impressive.",1
"863","The more I've played Hitman’s debut “episode” the more I've enjoyed it. Despite the often boneheaded AI and dire loading times, Hitman has definitely combined the best of both worlds. There’s scope for it to improve in some areas as the levels are released throughout the year but this is a fun, confident start.",1
"864","Headlander is an unexpectedly great take on Metroidviania-style action. Some of the objective design renders its flashier, body-endangering powers moot, but the quick and complex moment-to-moment gameplay carries it splendidly.",1
"865","Pokkén Tournament takes pieces from many fighting favorites and successfully blends them.",1
"866","The visceral and varied combat is fun, the beast-based gameplay is a winner, and the lure of camp-claiming, gear-crafting, beast hunting, and resource gathering remains irresistible. It’s weakened, however, by a disappointing lack of investment in its story, some often forgettable quests, and its vanilla villains, which unfortunately combine to make Primal feel like a step back from the memorable moments of Far Cry 3 and 4.",1
"867","In a time when shooters are competing to have the most modes, the biggest campaign, the most guns, and generally the most “stuff,” along comes Killing Floor 2, totally unconcerned with running that race. Its lack of modes and bosses will eventually turn away anyone but the most dedicated of fans, but its foundation is so fun and rock solid that, even if you only plan on playing for a few weeks with your friends, there’s plenty here to enjoy.",1
"868","System Rift does an admirable job of tying Breach mode into the main story while starting to fill in the gaps between Human Revolution and Mankind Divided, but it doesn't feel complete unto itself. You’ll get two to four hours more of excellent Deus Ex gameplay, and a glimpse of what the future may hold, but not much more, which is just a bit of a tease.",1
"869","Nuka-World has a great setting that’s densely packed with spectacle, surprises, and tough battles (depending on your level), and the ability to conquer settlements back on the main map is a fun novelty, but the lack of meaningful decisions leave it feeling more like an actual theme park ride than a choose-your-own-adventure story.",1
"870","A lack of balance robs the combat of much of its fun and renders many of the more interesting gameplay systems moot, but it didn’t dampen the emotional impact of I Am Setsuna’s heartfelt message for me.",1
"871","It’s hard to criticize something that seems like it was tailor-made for a wannabe competitive player like me, but I just can’t ignore how little Street Fighter 5 does for the average fighting game player.",1
"872","Star Fox Guard is a fun action-tower defense game about managing different perspectives to put out fires.",1
"873","Dead Rising 4 has the best core gameplay the series has ever seen. Its inventive and humorous ways to put down the dead are something I still haven’t tired of, and its surprisingly interesting plot is more than just a zombie-killing delivery system. Despite the technical blemishes that come with the series, its lack of co-op story mode play, and the fun-yet-unreliable multiplayer, Frank West’s return brings the series some fresh ideas, a ton of bloody mayhem, and a whole lot of cracking wise. Here’s hoping he sticks around for a while.",1
"874","It’s difficult but fair, and fast-paced but satisfying through to the end. And with a story so dangerously loaded with trope upon trope, it’s a joy to see Headlander sidestep some cliches with a beautiful setting, dark humor, and, well… a rocket-powered head. That’ll do the trick.",1
"875","The three almost entirely separate characters and play-styles keep the familiar Telltale formula feeling fresh and inviting. While some of the dialogue does feel overly expositional, it’s hopefully only there to provide concrete padding for future episodes, and the gorgeous, high-action combat sequences and creative detective work provide the right amount of contrast.",1
"876","The Painted World of Ariandel presents a land that’s both enticing and dangerous, and there’s plenty of challenges to face even if you won’t have to face them too many times. However, unless you really love dueling in PvP arenas and can find sustained interest there, this adventure may serve as more of an appetizer than a full course meal.",1
"877","The campaign is ignorable and the multiplayer needs a little technical work to be as good as last year’s, but the overly silly Zombies mode keeps me coming back. It may not stand out in a year that’s been crowded with great shooters, but it still produces that familiar Call of Duty action.",1
"878","Eagle Flight surprised me with how quickly I felt at home flying and fighting with other birds above Paris. It features some of the best and most responsive and comfortable gameplay available on the PSVR, though like most current VR games its appeal may be short-lived if you’re not a completionist who’s crazy about collectibles or high scores. This is a weird idea, well executed, that soars high.",1
"879","It’s a tribute to Telltale that the intricate, multi-layered plot and diverse cast of intertwined villains and madmen makes episode three’s lack of consequence and gameplay shortcomings excusable.",1
"880","Takes all of the solid foundations established by Episode 1, trims most of the fat, and continues to build an engaging Dark Knight story in a unique and uncharted version of the D.C. legend’s universe. Old Bat-fans will get much more out of the unexpected twists and turns than a newcomer, but the relationships Bruce Wayne forms and develops with the people around him appeal equally.",1
"881","Dead Rising 4 has the best core gameplay the series has ever seen. Its inventive and humorous ways to put down the dead are something I still haven’t tired of, and its surprisingly interesting plot is more than just a zombie-killing delivery system. Despite the technical blemishes that come with the series, its lack of co-op story mode play, and the fun-yet-unreliable multiplayer, Frank West’s return brings the series some fresh ideas, a ton of bloody mayhem, and a whole lot of cracking wise. Here’s hoping he sticks around for a while.",1
"882","The core snowboarding and skiing events are enjoyable enough to easily forgive mediocre elements, like the slow and sleepy paragliding mode, that feel like needless gimmicks. I just wish the latter weren’t mandatory.",1
"883","Dragon Ball Xenoverse 2 is an ambitious , if rough-edged experience, with deceptively deep RPG and brawling elements.",1
"884","I enjoyed just about every minute I spent playing Steep. Grandiose, attractive environments serving as the backdrop to varied, intense challenges are enough on their own to make this wintry playground somewhere I was always delighted to go back to and spend more time in - a feeling I still have even after finishing the bulk of the content, though the lack of mechanical customization and progression makes it harder to find reasons to return.",1
"885","Though it doesn't introduce many game-changing ideas, Grow Up takes B.U.D. to a bigger playground to climb in.",1
"886","I enjoyed just about every minute I spent playing Steep. Grandiose, attractive environments serving as the backdrop to varied, intense challenges are enough on their own to make this wintry playground somewhere I was always delighted to go back to and spend more time in - a feeling I still have even after finishing the bulk of the content, though the lack of mechanical customization and progression makes it harder to find reasons to return.",1
"887","Job Simulator's simple tasks are made fun by its absurdist sense of humor and goofy props. It'll test the limits of the PlayStation VR's motion tracking abilities by enticing you to reach for every object and device you can see, which sometimes makes things a little frustrating. But the rewards for experimentation make it well worth doing.",1
"888","Tumblestone is a clever and intriguing puzzle game... with a somewhat confusing selling model and and awful art department.",1
"889","The Painted World of Ariandel presents a land that’s both enticing and dangerous, and there’s plenty of challenges to face even if you won’t have to face them too many times. However, unless you really love dueling in PvP arenas and can find sustained interest there, this adventure may serve as more of an appetizer than a full course meal.",1
"890","Progression and microtransaction problems aside, after a VR stint in EVE Valkyrie I don’t think I’ll ever be able to go back to playing a dogfighting game on a regular screen. It’s just too good at showing me what I’ve been missing by not being able to look around freely as I pursue or evade targets. The intense and movie-like moments of strafing an enemy carrier while dodging incoming fire are a thrill.",1
"891","Human: Fall Flat’s slapstick controls and ridiculous animation do a great job of making repeated, frustrating, and unfair failure at physics puzzles seem fun for a while. And when that fun runs out, you can extend it by bringing in a friend and drawing silly things on your goofball character. If you don’t play it, watch someone play it.",1
"892","Progression and microtransaction problems aside, after a VR stint in EVE Valkyrie I don’t think I’ll ever be able to go back to playing a dogfighting game on a regular screen. It’s just too good at showing me what I’ve been missing by not being able to look around freely as I pursue or evade targets. The intense and movie-like moments of strafing an enemy carrier while dodging incoming fire are a thrill. [Tested with VR]",1
"893","Once you break free from the tactics-focused mindset of most RTS games, Ashes of the Singularity is a challenging, engrossing, and cerebral exercise in strategy that has me mentally iterating on army compositions, build timings, and board deployment schemes even when I’m not playing it.",1
"894","Star Fox Zero’s fun stages and impressive boss fight give me lot of reasons to jump back in and play them over and over, and especially enjoyed them in co-op until I got a hang of juggling two screens myself. I’ve played 15 hours and I still haven’t found everything. Learning to use the unintuitive controls is a difficult barrier to entry, though it comes with a payoff if you can stick with it.",1
"895","I really miss 2K Showcase, and 2K17 is still weak in areas that I feel should have been shored up by now, but its excellent combat, and generous amounts of customization help it retain its title.",1
"896","WWE 2K17 doesn’t make any big, drastic changes, but its smart gameplay tweaks have revitalized match types I’d ignored the past few years. I really miss 2K Showcase, and 2K17 is still weak in areas that I feel should have been shored up by now, but its excellent combat, and generous amounts of customization help it retain its title.",1
"897","Mafia 3’s strong characters and confident storytelling kept me engaged, even if the gameplay rarely delivered anything but bog-standard and repetitive open-world action.",1
"898","The results are satisfying. The story mode is brief, the narrative is mundane, and sadly the all-too-familiar Fallout 4 bugs are still hanging around, but the overall experience is rewarding, imaginative, and a pleasure to play.",1
"899","Lincoln is an incredible protagonist and New Bordeaux is a fantastic setting thematically, and it would’ve been great to see them put to better use.",1
"900","Long after its many blood-soaked dismemberments fade from my memory, I’ll remember just how alien and otherworldly it felt between the fits of violence.",1
"901","Mafia 3’s strong characters and confident storytelling kept me engaged, even if the gameplay rarely delivered anything but bog-standard and repetitive open-world action. That’s a bummer, because Lincoln is an incredible protagonist and New Bordeaux is a fantastic setting thematically, and it would’ve been great to see them put to better use.",1
"902","While Fire and Ice’s art direction and music are woefully generic, the well-constructed level layouts create a solid arcade-style experience that accomplishes a sense of extraordinary speed while accommodating a reasonable degree of control. Sonic Boom successfully draws from much of what makes the best of classic Sonic game play satisfying, sprinkles in a better-conceived exploratory structure, and remixes it into an intelligent, cohesive, and rewarding package.",1
"903","Nex Machina is not for the faint of heart, but a recipe to delight those looking for an attractive, arcadey challenge to overcome.",1
"904","Resident Evil 7 grounds itself in elements that made the original great while still indulging in a risky new shift in style that both helps and hurts the beloved formula in equal measure. But it’s also the closest a numbered sequel has come to recapturing Resident Evil’s slow, but thrilling and atmospheric adventure game roots in a while — a welcome return that I truly hope to see more of in the future.",1
"905","Resident Evil 7 grounds itself in elements that made the original great while still indulging in a risky new shift in style that both helps and hurts the beloved formula in equal measure. But it’s also the closest a numbered sequel has come to recapturing Resident Evil’s slow, but thrilling and atmospheric adventure game roots in a while — a welcome return that I truly hope to see more of in the future.",1
"906","Funny and fresh from beginning to end, Paradigm is a traditional point-and-click adventure game full of heart and decapitated heads in jars. The Eastern European setting, great voice acting, and confident comedy shine throughout its roughly six hours. Relatively simple puzzles aside, Paradigm offers a fresh and memorable entry in a genre that I'm happy to see alive and well in 2017.",1
"907","To distinguish itself from the MOBA crowd, Battlerite went for pure, skill-based action and hit the mark dead center. The fluid mouse-and-WASD-driven combat makes every move count and the quick pace of its 10-minute matches never lets off the gas. Even with its lackluster randomized progression system robbing it of momentum, Battlerite keeps me coming back to improve and add to my bag of tricks along the way. Stunlock’s approach to MOBA combat creates a near-even playing field that makes each outplay feel earned, whether it was me or my foe picking up the win. These arenas are places I can see myself brawling for a long time to come.",1
"908","Based on its colorful world, beautiful animation, and source material you might expect Mario + Rabbids: Kingdom Battle to be “My first turn-based tactics game.” But you’re in for a surprise: even for XCOM vets some of its battles are challenging puzzles. Some of its tougher levels do devolve into a trial-and-error slog, but a good mix of enemies, objectives, and character abilities keep things interesting.",1
"909","Prey’s curious alternate-history universe, intriguing sidequests, hidden threats, and detailed environmental storytelling make Talos I a joy to explore. The unsettling sense of paranoia that comes from knowing any object could turn out to be a hidden enemy gives even the quiet moments a palpable tension. All of that picks up the slack for combat and stealth that doesn’t feel fresh enough to sustain it throughout what can be a long game.",1
"910","It was wonderfully satisfying to have more Dishonored to play, even if Death of the Outsider doesn’t quite meet the high bar Dishonored 2 set in story or mission design. Even though it’s a shorter and slightly shallower game, there are some exciting new abilities and interesting changes to the energy system, and the freedom from consequences of Chaos further encourage experimentation and freedom. All in all, it’s a worthy end to the story that began five years ago.",1
"911","Despite the frustrations its upgrade system often caused me, I had a good time navigating Nex Machina’s array of twin-stick shooter challenges. The appealing art, energetic soundtrack, and pixel-perfect gamepad controls made me own every failure and look forward to whatever might come next.",1
"912","Uncharted: The Lost Legacy succeeds on the strength of its characters, writing, and phenomenal depiction of India’s jungles and ruins. Being in the company of Chloe and Nadine keeps its overly familiar action sequences and disappointingly empty open-world area interesting, and it regains its footing in smart puzzles and thrilling cinematic moments.",1
"913","Ultimately, FIFA 18 introduces enough new ideas to suggest it’s not sitting on the laurels of its success. However, it’s a simplified experience, one that fails to embrace the complexity of football at the highest level. Its focus on attack makes for spectacular matches, but they often feel like extravagant offensive training sessions than a proper match with depth and strategy.",1
"914","Ultimately, FIFA 18 introduces enough new ideas to suggest it’s not sitting on the laurels of its success. However, it’s a simplified experience, one that fails to embrace the complexity of football at the highest level. Its focus on attack makes for spectacular matches, but they often feel like extravagant offensive training sessions than a proper match with depth and strategy.",1
"915","There’s a lot to love in Nintendo’s second iteration of its quirky shooter, especially the way Splatoon 2 emphasizes splatting the ground just as much as it does inking your opponents. The new additions to its single-player campaign and multiplayer modes are a step in the right direction, but it still has some work to do to make joining online games and voice chat less of a hassle. Still, with an addicting new Salmon Run co-op mode and the promise of free updates like the ones that helped the original Splatoon come into its own, I expect Splatoon 2 to keep me hooked.",1
"916","Hand of Fate 2 doesn’t change much of the concept that made the first game so appealing, but everything here – whether it's challenges, smarter deck building, companion characters, and better combat – marks a major improvement over what we saw in 2015. Repetitiveness can still be a problem, but it takes much longer for it to show up. This time around, this is definitely a hand worth playing.",1
"917","Dark Souls 3: The Ringed City has found a way to revisit the past without a cheap reliance on nostalgia, wrapping up the story of Dark Souls in a way that will be satisfying for fans who enjoy digging into the rich lore the series has been building for the last few years. But you don’t need an encyclopedic knowledge of the Souls series to appreciate the satisfying twists and turns of this short, but exciting adventure, with its abundance of haunting, secret-filled locales and terrifying boss fights.",1
"918","Dark Souls 3: The Ringed City has found a way to revisit the past without a cheap reliance on nostalgia, wrapping up the story of Dark Souls in a way that will be satisfying for fans who enjoy digging into the rich lore the series has been building for the last few years. But you don’t need an encyclopedic knowledge of the Souls series to appreciate the satisfying twists and turns of this short, but exciting adventure, with its abundance of haunting, secret-filled locales and terrifying boss fights.",1
"919","Hand of Fate 2 doesn’t change much of the concept that made the first game so appealing, but everything here – whether it's challenges, smarter deck building, companion characters, and better combat – marks a major improvement over what we saw in 2015. Repetitiveness can still be a problem, but it takes much longer for it to show up. This time around, this is definitely a hand worth playing.",1
"920","The Evil Within 2 gives you more options to play your way in a much bigger survival-horror playground than the original. Although a disjointed plot and weak protagonist make it slow to get started, being pursued through an intriguingly bizarre world by plentiful and disturbing monsters kept my palms sweaty and my heart in my throat thanks to a strict adherence to the most important survival horror rule: you should always be on the back foot.",1
"921","It was wonderfully satisfying to have more Dishonored to play, even if Death of the Outsider doesn’t quite meet the high bar Dishonored 2 set in story or mission design. Even though it’s a shorter and slightly shallower game, there are some exciting new abilities and interesting changes to the energy system, and the freedom from consequences of Chaos further encourage experimentation and freedom. All in all, it’s a worthy end to the story that began five years ago.",1
"922","The Crimson Court pumps Darkest Dungeon full of disturbing blood-sucking enemies, a challenging new class, and a marathon-style new area that forces you to think differently about how to sustain your team over a long run. While there’s definitely enough new content in The Crimson Court to come back to Darkest Dungeon for, it’s more the kind of DLC that mixes things up for a new replay than an essential upgrade you should install from the beginning.",1
"923","Ultimately, Danganronpa V3 doesn’t add too much new to the series. But that’s okay – it doesn’t need to reinvent the wheel when the wheel we already have still rolls out eclectic characters and shocking moments so reliably. It’s a great rollercoaster of hope and despair with a climax that made me sit back and think about everything that just happened. The road to the end of Danganronpa V3 is long and twisted, but the ride is well worth it.",1
"924","On the battlefield, Fire Emblem Echoes: Shades of Valentia is a delightful look into the simpler combat of Fire Emblem’s past. Elsewhere, it carefully guides the series forward into new territory. There’s not as much depth as I expect from this series, but whether I was exploring 3D forests and caves in a series first or learning first hand why Fire Emblem’s early entries are considered a formidable challenge, it was usually good old-fashioned fun.",1
"925","Ultimately, FIFA 18 introduces enough new ideas to suggest it’s not sitting on the laurels of its success. However, it’s a simplified experience, one that fails to embrace the complexity of football at the highest level. Its focus on attack makes for spectacular matches, but they often feel like extravagant offensive training sessions than a proper match with depth and strategy.",1
"926","It was wonderfully satisfying to have more Dishonored to play, even if Death of the Outsider doesn’t quite meet the high bar Dishonored 2 set in story or mission design. Even though it’s a shorter and slightly shallower game, there are some exciting new abilities and interesting changes to the energy system, and the freedom from consequences of Chaos further encourage experimentation and freedom. All in all, it’s a worthy end to the story that began five years ago.",1
