"","review","score"
"317","Halo Wars 2 will scratch a real-time strategy itch and give you a dose of Halo-Universe flavor with a decent story, but it won’t go much deeper than that. A run-of-the-mill campaign, controls that hamper micromanagement, conspicuous bugs, and multiplayer that relies on luck limit its long-term appeal, but its fast and flashy action makes it fun for a while.",0
"318","While its antiquated roots cause some minor frustration with unreliable hitboxes and unnecessary grinding, the foundational combat and exploration is still engaging and fun after 30 years. From long-time Wonder Boy fans to platformer enthusiasts who’ve never heard of it until now, you’ll likely be able to find whimsical fun and a neat bit of genre history in this charming adventure.",0
"319","While its antiquated roots cause some minor frustration with unreliable hitboxes and unnecessary grinding, the foundational combat and exploration is still engaging and fun after 30 years. From long-time Wonder Boy fans to platformer enthusiasts who’ve never heard of it until now, you’ll likely be able to find whimsical fun and a neat bit of genre history in this charming adventure.",0
"320","With three hits and three duds from Capcom/Disney years that you might remember with varying levels of fondness, the Disney Afternoon Collection is clearly aimed at children of the 90s. I have trouble seeing its appeal to anyone else. But if vintage duck-based platformers are your thing, grab a Capri Sun and a handful of Gushers and invite your friends over to play.",0
"321","While it’s a shame that its dungeon dwelling enemies are far too easily exploited, Blaster Master Zero is ultimately an enjoyable reimagining of a largely overlooked 8-bit classic thanks to the rewarding exploration-focussed structure of its side-scrolling overworld. There are enough secret rooms and power-ups to seek out (including an additional ending), that I was compelled to scour every last inch over the course of my eight-hour completion time. It’s a good reboot; just not a Masterful one.",0
"322","Star Trek: Bridge Crew feels like a promising first draft of a fantastic Trek simulator, but it only goes boldly for a few hours. After the novelty of finally sitting on a beautiful Federation starship bridge wears off and you’ve exhausted the handful of mission types, all that’s left is the goofy physical comedy of messing around with your friends or strangers in VR.",0
"323","Poochy & Yoshi’s Woolly World remains one of the cutest games around. Even though most of the tactile charm of the Wii U original has been lost to the 3DS’s technical limitations, there’s still plenty of fun to be uncovered in this colourful and often inventive platformer. Incidentally, it also brings some of the happiest, catchiest music ever to the 3DS.",0
"324","Because of its diminished graphics and clumsy combat controls, Skyrim VR definitely isn’t the best way to actually play Skyrim. However, if you leave the difficulty on the default lowest setting and roam the world as a god who can slay enemies with the flick of the wrist, it’s a good way to experience Bethesda’s legendary RPG from a whole new perspective.",0
"325","I'm glad that, in NHL 18, EA continues to seek out new players for the NHL series with smart upgrades to the training system and the exciting and accessible NHL Threes mode. Those are positive strides, but the rest of the modes and features are starting to feel too familiar. If you're someone who's been following the NHL series for years, you aren't getting anything drastically new here to alter the balance or restore excitement. The EASHL is still enjoyable with a great group of buddies, and the other offline modes are decent, but this series is in need of some new approaches to gameplay and refreshes of older modes.",0
"326","With three hits and three duds from Capcom/Disney years that you might remember with varying levels of fondness, the Disney Afternoon Collection is clearly aimed at children of the 90s. I have trouble seeing its appeal to anyone else. But if vintage duck-based platformers are your thing, grab a Capri Sun and a handful of Gushers and invite your friends over to play.",0
"327","With three hits and three duds from Capcom/Disney years that you might remember with varying levels of fondness, the Disney Afternoon Collection is clearly aimed at children of the 90s. I have trouble seeing its appeal to anyone else. But if vintage duck-based platformers are your thing, grab a Capri Sun and a handful of Gushers and invite your friends over to play.",0
"328","Star Trek: Bridge Crew feels like a promising first draft of a fantastic Trek simulator, but it only goes boldly for a few hours. After the novelty of finally sitting on a beautiful Federation starship bridge wears off and you’ve exhausted the handful of mission types, all that’s left is the goofy physical comedy of messing around with your friends or strangers in VR.",0
"329","Despite a lackluster ending to “Above the Law,” A New Frontier’s third episode kept me invested in Javi’s story, if not the plot as a whole. I’m a bit more wary heading into the latter half of the season after the jarring number of character entrances and exits in this episode, but if the strong character work continues, I’m more than willing to roll through the bumps of this mid-season episode. Telltale has found a sharp lens in Javi through which to analyze the ideas of family as bonds we’re forced into and choose to make ourselves. And he’s a lens, even in the season’s weakest moments, I still find myself wanting to help survive.",0
"330","Slithering up simple structures in Snake Pass is one of the most mechanically satisfying video game ideas I’ve ever experience, and it effectively creates a sensation that feels the way maneuvering like a snake might. The camera and checkpoint systems aren’t great, but the concept still managed to hook me for the five hours it took wrap up the campaign. And in the end, I wanted to go back and replay stages to round up all the collectibles I missed.",0
"331","The Switch version of Resident Evil: Revelations 2 capably handles this entertaining horror experience. The frame rate is steady and the motion controls are mostly worth using. Load times can drag on, but they aren’t frequent enough to be a big issue. If you appreciate the thrill of sharing intimate zombie encounters with a friend, the ability to play this local co-op story with one Joy-Con a piece makes it a handy game to have on your Switch.",0
"332","Yooka-Laylee contains all the pieces needed for a fun, enjoyable throwback to the 3D collectathons of the 64-bit era. The characters are charming and funny, your set of abilities is vast and entertaining, and four out of five of the worlds are fun playgrounds to explore. While it lacks the heart and polish of some of its incredible predecessors, it’s a good reminder that this genre, once thought to be dead, still has some life left in it.",0
"333","Yooka-Laylee contains all the pieces needed for a fun, enjoyable throwback to the 3D collectathons of the 64-bit era. The characters are charming and funny, your set of abilities is vast and entertaining, and four out of five of the worlds are fun playgrounds to explore. While it lacks the heart and polish of some of its incredible predecessors, it’s a good reminder that this genre, once thought to be dead, still has some life left in it.",0
"334","Matterfall succeeds in adapting Housemarque’s trademark style of fast, action-packed, arcadey action to the 2D platformer genre, but it feels like a puzzle half solved. There’s virtually no content here after you finish its exceptionally short campaign, outside of some harder difficulty modes and a global leaderboard to climb, and its level design isn’t well-suited for replay value. It’s a ton of fun while it lasts, but once it’s over it’s hard to not be left with a feeling of “Is that it?”",0
"335","NBA Live 18’s simplistic and fluid mechanics make for an approachable game of NBA, or WNBA, basketball. But for all that it does well on the court, elsewhere it fails to live up to its potential. There are plenty of side modes, but few have the depth or interesting new ideas to be worth getting invested in.",0
"336","NBA Live 18’s simplistic and fluid mechanics make for an approachable game of NBA, or WNBA, basketball. But for all that it does well on the court, elsewhere it fails to live up to its potential. There are plenty of side modes, but few have the depth or interesting new ideas to be worth getting invested in.",0
"337","The Switch version has slightly fewer shadows and lighting effects, but the colorful stages look good on the system in docked or handheld mode.",0
"338","Not having to lug around a portal to play it is incredibly convenient, on the other hand. It’s great to just tap your Skylander on the right thumbstick, like you would with an Amiibo, and have it be recognized by the hardware in a matter of seconds. This is our first chance to play Skylanders on the go, and this takes the the idea of being able to bring your Imaginators to your friends’ houses to adventure together to a whole new level.",0
"339","While it’s the weakest episode so far, More Than A Feeling still has some moments of payoff for leadership successes (and failures) earlier in the series.",0
"340","A very predictable update to a long-running series of dancing games that shines in visual design and unique choreography but is very loose with its tracking of your body movements. It’s not going to teach you to be a professional dancer, and it honestly doesn’t really teach you how to be good at Just Dance itself. That said, it’s still a whole lot of fun to play, and the songs that aren’t locked behind a paywall are varied and, largely, recognisable.",0
"341","LEGO Worlds is commendable for its environmental diversity and the power of its creative tools to build anything you can dream of or manipulate every castle, hillside, and forest in sight. Unfortunately, fiddly menus, a pretty terrible combat system, and at times clunky and unfriendly construction controls weigh down on the wonder of finding and creating. Despite all this, I still find myself drawn back into it to discover what more the designers have hidden in the world-generation code, as coming across a massive ruined castle or an active volcano for the first time is always a treat - and an inspiration for what I want to build next.",0
"342","“Thicker Than Water,” other than its satisfying ending, is the season’s weakest episode yet. Little that precedes the action-packed conclusion feels like it has much, if any, weight to the ongoing story I’m invested in — namely Javi’s life and his relationships with Kate, Clem, and David. I’m absolutely on the hook for the season finale after that strong start and thrilling ending — I just wish everything before it hadn’t felt so thin.",0
"343","Slithering up simple structures in Snake Pass is one of the most mechanically satisfying video game ideas I’ve ever experience, and it effectively creates a sensation that feels the way maneuvering like a snake might. The camera and checkpoint systems aren’t great, but the concept still managed to hook me for the five hours it took wrap up the campaign. And in the end, I wanted to go back and replay stages to round up all the collectibles I missed.",0
"344","Rebounding from a weak second episode, Batman: The Enemy Within’s third episode restores my hopes that this season will turn out well. Major developments around Batman’s big secret and strong interactions with Harley Quinn, Selina Kyle, and John make Fractured Mask work, right up until the extremely abrupt ending.",0
"345","Thanks to the imprecision of its shooting controls and the cheap behaviour of its AI, I could never really develop any confidence in Tokyo 42’s frustrating combat. Which is a shame because, glitches aside, I really loved exploring the wonderfully crafted world and the simple yet still challenging nature of its stealth-based assassinations.",0
"346","WRC 7 doesn’t unseat Codemasters’ Dirt 4 as this year’s premier rally game, but it definitely continues Kylotonn’s upward trajectory in the genre. It lacks the classic cars that consistently appear in other rally games and the career quickly runs out of puff, but it’s well worth playing to attack its excellent courses – especially its monster Epic Stages.",0
"347","Halo Wars 2 will scratch a real-time strategy itch and give you a dose of Halo-Universe flavor with a decent story, but it won’t go much deeper than that. A run-of-the-mill campaign, controls that hamper micromanagement, conspicuous bugs, and multiplayer that relies on luck limit its long-term appeal, but its fast and flashy action makes it fun for a while.",0
"348","WRC 7 doesn’t unseat Codemasters’ Dirt 4 as this year’s premier rally game, but it definitely continues Kylotonn’s upward trajectory in the genre. It lacks the classic cars that consistently appear in other rally games and the career quickly runs out of puff, but it’s well worth playing to attack its excellent courses – especially its monster Epic Stages.",0
"349","The Signal From Tölva serves up a promising sci-fi concept, one that is made more intriguing by the ability to manipulate robot factions and some occasional awe-inspiring sights and sounds. But sometimes a slow burn can be a bit too slow thanks to its plodding movement speed, and that’s the case here. If you’re willing to wade through some deliberate pacing and lots of walking between repetitious shootouts with similar robot enemies, there are some intriguing bursts of action and sci-fi lore waiting for you on the hills of Tölva.",0
"350","The pacing is spot-on, the combat satisfying and the gameplay varied. Co-op is genuinely good fun too, and most definitely the best way for younger gamers to get into the action. Knack 2 is definitely a step up from the original, then, but until the writing and characterisation improve drastically, it’s not going to be a true first party titan.",0
"351","There’s not a lot of meat to Hey! Pikmin, which is disappointing when compared to the required skill and replayability of the console Pikmin games. It’s good for a playthrough, but this is a voyage I can’t see myself taking again.",0
"352","As you’d expect, the PC and PS4 Pro versions are the best looking versions of Snake Pass, with options for higher display resolutions and better lighting.",0
"353","Underneath a forgettable campaign and unimpressive AI, Tiny Metal houses the seed of a really deep and entertaining multiplayer wargame. But until a head-to-head mode is added, it’s not much more than a set of unchallenging training scenarios broken up by far too much overwrought dialogue. I had plenty of fun with it, but didn’t get the kind of edge-of-my-seat decision-making moments that turned the tide of a difficult battle I could find in similar games.",0
"354","A broad and goofy arsenal of unique weapons and gadgets and the ability to switch characters on the fly to access complementary abilities offers some solid combat and good mindless fun, but due to some unpolished writing and repetitive environments and enemy types, it doesn't fully live up to its heroic potential.",0
"355","Sure, it could’ve done so with a bit more subtlety – it's a bit heavy-handed at the very end – but at least Black does have a point to make. It’s just a shame that it wrapped that in a game that’s so shamelessly and distractingly derivative.",0
"356","Battlefront 2 does a lot of things right, offering a Star Wars experience that’s stunning to look at and wonderfully faithful to the source material, but it stumbles hard on the delivery. The campaign is amusing but scatterbrained, and worse, in multiplayer the randomized progression systems are downright hostile toward its players. EA has already made two big adjustments to this system in the week leading up to launch alone, and we can only hope that more significant changes are on the way. But right now, the Star Cards system’s frustrating progression is actively driving me away from the multiplayer battles.",0
"357","The core of Episode 5: Don’t Stop Believin’ provides a thrilling and fulfilling resolution to the season arc with a couple interesting surprises in store. I just wish it hadn’t been immersed in this flimsy, fake crisis of the Guardians breaking up and getting back together that was never fully realized, and ended up dragging the whole season down.",0
"358","Under the better-than-ever graphics and great-as-ever core wrestling gameplay, WWE 2K18 is a largely disappointing iteration. It wastes too much of its ambition on the poorly written and dull MyCareer RPG mode, leaving its other promising modes to languish for another year. What few enhancements we get to the carry mechanics and eight-person matches are welcome, but not as much of a year-over-year refresh as would be needed to keep the excitement level as high as it’s been in past years.",0
"359","Battlefront 2 does a lot of things right, offering a Star Wars experience that’s stunning to look at and wonderfully faithful to the source material, but it stumbles hard on the delivery. The campaign is amusing but scatterbrained, and worse, in multiplayer the randomized progression systems are downright hostile toward its players. EA has already made two big adjustments to this system in the week leading up to launch alone, and we can only hope that more significant changes are on the way. But right now, the Star Cards system’s frustrating progression is actively driving me away from the multiplayer battles.",0
"360","Under the better-than-ever graphics and great-as-ever core wrestling gameplay, WWE 2K18 is a largely disappointing iteration. It wastes too much of its ambition on the poorly written and dull MyCareer RPG mode, leaving its other promising modes to languish for another year. What few enhancements we get to the carry mechanics and eight-person matches are welcome, but not as much of a year-over-year refresh as would be needed to keep the excitement level as high as it’s been in past years.",0
"361","Sure, it could’ve done so with a bit more subtlety – it's a bit heavy-handed at the very end – but at least Black does have a point to make. It’s just a shame that it wrapped that in a game that’s so shamelessly and distractingly derivative.",0
"362","Kylotonn has dredged this near-forgotten racing rebel from the very bottom of the barrel and fashioned it into a basic but fun, stunt-filled speedster, but I found myself regularly frustrated with its repetitive career mode, its stingy economy and nebulous unlockables, its superficial demolition derby events, and its uneven difficulty. A respectable franchise rescue mission but one that still needs some fine tuning and some extra grunt.",0
"363","NBA Playgrounds isn’t as deep as NBA Street or as beautifully simple as NBA Jam, but the gameplay is still well paced and the controls are still tight. It mixes this gameplay with cartoonish qualities and a retro style that fits an arcade basketball game, and earning new packs of random players is always rewarding. That said, I’ve taken some bad beats from the random power-ups system, and the online options are slimmer than I’d like.",0
"364","Battlefront 2 does a lot of things right, offering a Star Wars experience that’s stunning to look at and wonderfully faithful to the source material, but it stumbles hard on the delivery. The campaign is amusing but scatterbrained, and worse, in multiplayer the randomized progression systems are downright hostile toward its players. EA has already made two big adjustments to this system in the week leading up to launch alone, and we can only hope that more significant changes are on the way. But right now, the Star Cards system’s frustrating progression is actively driving me away from the multiplayer battles.",0
"365","It’s worth a look for Burnout veterans, as long as you calibrate your expectations appropriately.",0
"366","A broad and goofy arsenal of unique weapons and gadgets and the ability to switch characters on the fly to access complementary abilities offers some solid combat and good mindless fun, but due to some unpolished writing and repetitive environments and enemy types, it doesn't fully live up to its heroic potential.",0
"367","There are already so many different ways to play Minecraft, and the 3DS version fails to live up to the standards set by the other versions. It’s not a bad slice of pizza, but there are so many better choices.",0
"368","Kylotonn has dredged this near-forgotten racing rebel from the very bottom of the barrel and fashioned it into a basic but fun, stunt-filled speedster, but I found myself regularly frustrated with its repetitive career mode, its stingy economy and nebulous unlockables, its superficial demolition derby events, and its uneven difficulty. A respectable franchise rescue mission but one that still needs some fine tuning and some extra grunt.",0
"369","When you’re playing as Jason, this is unquestionably the best Friday the 13th game ever made. I really appreciate the genuine love for the franchise on display here. Hunting down players and executing them in spectacularly gory scenes is an homage that warms my lifelong Friday-fan heart. But the fun of its asymmetrical multiplayer-only action is heavily skewed toward Jason, which means you’ll mostly be stuck playing as teens rummaging through drawers.",0
"370","1-2-Switch is a successful demonstration of unique hardware, but a shallow, gimmicky game.",0
"371","On top of the joy of creating and playing as your own character, there’s a lot of goofy charm that makes Sonic Forces hard to be too disappointed with. The graphics are colorful and engaging, and the music is a pumping backdrop for extreme team-ups, super-speed cinematics, and lots of ruminations on the power of friendship. There are some really fun levels in the mix, too, and surprisingly strong boss fights make for some unexpected highlights. But Sonic Forces doesn’t build on its handful of good ideas as much as it should, and it screeches to a halt just as it seems to hit its stride.",0
"372","Gris is, at times, a meditative, affecting exploration of complex emotions that uses its levels as a canvas for some of the most beautiful visual design in any platformer, backed by a fantastic score. At others, it’s a maddeningly simple and confusing game that lets its artistic ambitions run roughshod over its gameplay.",0
"373","Gris is, at times, a meditative, affecting exploration of complex emotions that uses its levels as a canvas for some of the most beautiful visual design in any platformer, backed by a fantastic score. At others, it’s a maddeningly simple and confusing game that lets its artistic ambitions run roughshod over its gameplay.",0
"374","BattleTech provides exciting strategic decisions and a compelling story, plus the slow-paced and meticulous fun of building up and customizing a mercenary company but suffers from the frustrating unpredictability of its weapons and procedural missions, and losing a favorite mechwarrior to a random head hit feels like it somewhat undermines the choices I’ve made along the way.",0
"375","Like the gaming equivalent of binge-watching a playlist of the funniest Vine videos, WarioWare Gold provides some enjoyable short attention span shenanigans, particularly for newcomers. But in the absence any substantial new additions and a paucity of worthwhile extras, WarioWare Gold is more like a runner-up silver for long term fans of the series.",0
"376","Strong characters and environmental storytelling make The Awesome Adventures of Captain Spirit enjoyable overall. Despite the main objectives being underwhelming and the decisions seeming weightless, I became invested in the outcome of the story thanks to Chris’ lovable sense of wonder against a well-painted dreary backdrop. Captain Spirit makes me optimistic about what's to come in Life is Strange 2.",0
"377","With or without the unnecessary toys, Starlink: Battle for Atlas is a commendable space adventure. Even with the repetitive grind and randomly scattershot space combat, this is a great-looking, gratifying game of strategic action and environmental exploration. Switch owners are undoubtedly the winners, but there’s something here to enjoy on any platform.",0
"378","It’s mechanically repetitive no matter what planet you’re on, the dull combat should be avoided whenever possible, and bugs are plentiful. But buying new ships and building new things is enough motivation to make it entrancing – for a while, at least.",0
"379","The 14 dated games included in the SNK 40th Anniversary Collection aren’t the stars of the show -- the care that was taken in dusting them off and presenting them is.",0
"380","WWE 2K19 is a rebound in the right direction, but it is held back by many long-standing issues.",0
"381","WWE 2K19 is a rebound in the right direction, but it is held back by many long-standing issues.",0
"382","While some of the exposition-heavy conversations drone on longer than they should, it ends on a powerful note foreshadowing some difficult lessons Clementine has yet to learn about what it means to grow up and lead in a post-society world.",0
