"","review","score"
"1","Despite the disappointing multiplayer options, the clichéd characters, and the sometimes repetitious nature of the campaign, the strategy gameplay of Shadow Wars is fun enough to make it a worthy recommendation for any turn-based enthusiast.",0
"2","The[] ability to tear apart and repair the environments at will is a hook that keeps working, and when the campaign gives you plenty of stuff to tear apart it's easy to lose yourself to a primal need to destroy.",0
"3","It's funny, it clever, and it answers a lot of questions I had. I enjoyed playing it, but I didn't love it. The story isn't as grounded as I'd like it to be at certain points, so it throws the balance of sincere/goofy off. I wanted the conclusion of the serious movie feelings episode one started, but I got the comical ending of a Saturday morning cartoon.",0
"4","Through questionable level design, graphical inconsistency, and repetitive gameplay, I was pulled out of the experience more than I would have liked. Alice: Madness Returns is a memorable peek through a flawed looking glass.",0
"5","With a level-headed team of four, Magicka's cooperative action is entrancing chaos. It's rare for a game to feel this mechanically satisfying.",0
"6","Serious Sam 3: BFE will ultimately exhaust its players by virtue of its screen-filling mega-confrontations, its non-stop repetition and the sense that you are almost always mercilessly outgunned. Sam 3 is good but could have been better.",0
"7","DCUO is far from a bad game; there are indeed times when it shines fantastically with the potential for greatness, but its many faults, most minor but some quite large, ensure that it never reaches those heights.",0
"8","A dungeon crawler with a boring loot table, poorly implemented multiplayer, and little lasting incentive to continue running around the world once the tedious story ends.",0
"9","There's something kind of addictive about teaching your fake dog new tricks. For repeat customers, unless your kid is still playing the first game religiously, I don't see the upgraded version holding their interest for nearly as long.",0
"10","There's something kind of addictive about teaching your fake dog new tricks. For repeat customers, unless your kid is still playing the first game religiously, I don't see the upgraded version holding their interest for nearly as long.",0
"11","There's something kind of addictive about teaching your fake dog new tricks. For repeat customers, unless your kid is still playing the first game religiously, I don't see the upgraded version holding their interest for nearly as long.",0
"12","It's just disappointing that the developers only added a handful of mostly inconsequential extra modes in the interim, and didn't take that extra time available to fix a few of the first versions' flaws.",0
"13","For its effective use of 3D gameplay and its simple yet refined design, PilotWings deserves a good deal of credit.",0
"14","There's a lot of talking and gathering things for other people. It's rather ho-hum.",0
"15","Caught somewhere between massively-multiplayer online role-playing game and hardcore competitive real-time strategy, Age of Empires Online delivers some of the most addictive parts of both. Some sloppy mechanics and balance and reward issues detract from the core Age of Empires experience, but not to the point that it's not worth playing.",0
"16","The lack of feedback, in-game competition, and unpredictability hurt the game's long-term draw; some older business simulations didn't have these problems. Cities in Motion does feature stellar tools and is one of the prettier business simulations on the market.",0
"17","An online shooter needs variety, depth, and addictiveness to succeed over the long term. Brink might find a niche with some hardcore fans, but it isn't for everyone. The PC version feels more complete than its console counterpart, but my qualms over content remain the same. Brink has heart, but the overall package is lacking.",0
"18","The majority of the new features introduced in The Sims 3: Generations are enjoyable enough to fiddle with, but none of them are major game changers.",0
"19","The content of Dead Money can get frustrating quickly. Still, for the patient souls out there, this fresh spin on Fallout is a decent buy.",0
"20","Sequence is sort of like serving someone a ham sandwich on a silver tray with all sorts of accoutrements. It's nice that it's a silver tray and not a paper plate, but I'm still eating a ham sandwich here.",0
"21","Homefront is certainly one of the most unique shooters I've ever played, driven by an ingenious and surprisingly well-fleshed out plot and a dark and dreary, realistic setting. But it also controls and feels like a typical shooter, looks like a game that's several years old, and most importantly, has an inexcusably brief campaign.",0
"22","Q.U.B.E. offers some short-term fun for puzzle fans and not a lot else. With so little emphasis put on story I can't help but feel that Q.U.B.E. may have benefitted from having no story elements at all, instead of loosely hinting at some bigger picture that goes unseen.",0
"23","Delivers an interesting and fun variation of a traditional card game and turns it into a competitive puzzle with myriad nuances to its strategy. Unfortunately, it doesn't do enough to keep the variation fresh throughout.",0
"24","It's far from a perfect game -- inconsistent AI, a campaign that borders on the short side, and limited multiplayer options certainly hamper the experience -- but there's a lot of challenging satisfaction to be found beneath the thick jungle canopy.",0
"25","The flawed story mode can be safely passed by, but if you're able to find an opponent online or skirmish against the AI it's easier to appreciate Oil Rush's strengths.",0
"26","A surprisingly rich title for a handheld console. It's perfect for a quick game on tiresome commutes.",0
"27","Whereas the console version of Sonic Generations is a blending of old and new mentality in a fast-paced speed fest, the 3DS version is mostly just a Sonic Rush game where both playable characters happen to be Sonic.",0
"28","While it's admirable that the team had opted to create an original story set alongside the events in the books, you'll wish that they had attempted to take more risks with the project. The characters are bland and lifeless, and the combat, while fun at first, gets pretty repetitive before too long.",0
"29","It's like an interactive coloring book made by a 10 year old obsessed with Mastodon.",0
"30","A fun but deceptively shallow Sim-RPG-thing that would have benefitted from pushing the envelope for either genre a little more.",0
"31","The vast amount of customization options and the simple but fun battle system kept me interested enough to overlook the poor execution of story.",0
"32","Despite its considerable flaws, at its core, Mercenaries is a ton of fun. From the moment I started playing it I couldn't put it down.",0
"33","Sure, it's not very deep from an RPG-elements perspective, nor does it have the kind of story that's going to make you go ""Hm!"", but it will entertain you and help whet your appetite for the monster-stomping extravaganza that will be Serious Sam 3.",0
"34","Purchasing Arrival means there's more to do in Mass Effect 2, and that's always a good thing. It sets up the tone of urgency that's prevalent in the Mass Effect 3 trailer, but don't expect it to explain a lot. If you don't mind combat-focused, linear missions, it's worth the $7.",0
"35","F1 experts have probably already been racing their way through the home console versions of this title since September. With the 3DS version's odd A.I., it's hard to recommend that Formula fans give this edition a go. Codemasters knows racing -- but when they pass off portable development to other teams, you've got to be wary.",0
"36","The massive character customization also makes your faery or elf feel unique, so if you enjoy leveling up and finding loot, you should check out Faery: Legends of Avalon.",0
"37","Well executed, but lacking in depth (which is ironic for a multitude of reasons). However, once you give it a fair shot, you'll be surprised how addictive the gameplay is and how much fun you'll have trying to master the controls and conquer each mission.",0
"38","If simple fun and the inclusion of Pokemon is all you're looking for, then Rumble Blast is the game for you. Otherwise, there are much more deserving 3DS titles to spend your hard-earned cash on.",0
"39","Despite its many shortcomings, Splinter Cell 3D is still fun to play. And that's what matters most. It's not even close to being as good as Chaos Theory on Xbox, but then again, I couldn't play that on a plane. If the AI were even passable and not laughable, this would be an easier recommendation.",0
"40","For us, it's all about the sweet science, and in this regard SFxT is still sorely lacking.",0
"41","Something of an uncanny experience. A lot of the experience remains intact but its vitality has been drained away. It's a muted affair, and that ultimately harms a game that derives so much of its charm from those little touches.",0
"42","It's good, chaotic fun and has a baseline level of quality and polish that's pleasing to see. If this is your first Wipeout game, chances are you'll have a blast. For veterans, however – especially those schooled in the delights of HD and Fury – this game just isn't as smooth in feel or as elegant in design.",0
"43","Little Inferno looks nice, tells a unique story and will perhaps be seen by some as a triumph in experimental design. But it's not really a video game, so feel free to forget this freaky fireplace.",0
"44","Tera's an action-MMO that nails the ""action"" part and then manages a face-palm-inducing face-plant on all the other bits.",0
"45","There's still plenty of life in the genre, as this creative romp amply demonstrates, even if fully appreciating it takes more patience than some will be able to muster.",0
"46","Has a nice, colorful approach to golf and a respectable set of multiplayer options. But the disconnect between the amount of time required to plan a shot and the milliseconds needed to mess it all up sparks ample frustrations.",0
"47","It's impressive that Namco-Bandai has managed to port a full-sized, voice-acted Japanese RPG to the 3DS without sacrificing any of the content from the PlayStation 2 version. But it's also a six-year-old game that hasn't aged well in all respects, and if you're a North American Tales fan, it's likely to be one you've played before.",0
"48","It's hard to deny the value of buying a pool game on Vita and getting its PlayStation 3 counterpart as an added bonus. And graphically, Hustle Kings looks really nice. So despite the odd musical choices, spooky floating cue, bad connectivity, and annoying precision camera, Hustle Kings is still a good game.",0
"49","In light of its technical flaws, we'd only cautiously recommend buying it on Vita. If you own a PS3, Xbox 360 or Wii U, you'd be better off with any of those versions, while those seeking a fast-paced racer that really makes their Vita sing should consider WipEout 2048 ahead of this.",0
"50","More variety in the graphics and gameplay modes would have helped, but for those who want to listen to music on a long flight, for example, Symphony provides an excellent way to enhance that experience and get a little gaming satisfaction on the way.",0
"51","The Secret World flirts with brilliance and – at least, during earlier zones – looks primed to seal the deal. But, as time goes on, its its seemingly bottomless bag of tricks starts to look a bit shallow.",0
"52","The real strength of When Vikings Attack is its humor. It doesn't take itself seriously, and provides a nice change of pace from the deluge of first-person shooters and bloody action games we're all becoming more accustomed to. But its gameplay won't hook you for more than a passing few hours.",0
"53","The idea of rotating orbits and fantastic aesthetics make Unstoppable Gorg feel striking and unique to start, but the rest of the game doesn't live up to that great first impression.",0
"54","War of the Roses isn't quite Mount and Blade or Battlefield, but it manages to walk a fine line between the two models to produce an innovative and enjoyable experience.",0
"55","The interplay between Horatio and Crispin as they push deeper into this pixelated robotic realm to recover their stolen goods is a high point in an adventure that feels like a bit of a slog despite its relatively short length.",0
"56","A fine game that Mega Man fans will enjoy once or twice, but one without that special something that would allow it to rise to the greatness Mega Man so regularly reached in its heyday.",0
"57","The moves and kills you'd expect are here, but the story is boiled down to be easy to jump in and out of. That takes away some of the excitement in playing through it.",0
"58","The game never embraces its Mario heritage, never allowing itself to break out of a more typical tennis mold to be something unique.",0
"59","It's Piranha Bytes' most accessible game yet, and though its style and boorish, humorous dialogue fit well with the pirate motif, it's a role-playing experience that uses convention as a crutch and marginalizes or strips away a lot of elements that made the studio's past games stand out.",0
"60","It's more of a short-term investment than some might be expecting, then, but while you're caught in its irresistible loot cycle, you'll probably find it very hard to put down.",0
"61","If you're at all interested in the interactive fiction genre, knowing full well that there's not a whole lot of actual interaction, that's an eminently fair price.",0
"62","Shad'O may not offer much in the way of new gameplay mechanics over the countless other tower defense games already available, but it distinguishes itself through its striking art design and compelling narrative.",0
"63","Beyond the winning localization and expert voice acting, though, playing through this adventure just felt lacking – its various unique ideas and innovations never came together to create a real sense of fun.",0
"64","Although it suffers from some inconsistent AI, spotty online matchmaking and some balancing problems created by Golden Abyss-centric augments, it's still hard to deny that Uncharted: Fight For Fortune is a fun game.",0
"65","While it has some great mini-games, it forcefully limits itself and discards many of the ideas that made its predecessors so good.",0
"66","F1 2011 isn't quite up to the excellent standard of the console version, but it's still far, far better than the 3DS instalment.",0
"67","With more maps, classes, the ability to server browse and customization options promised there's a lot of potential in Forge, but what you're buying now feels like a beta with a great foundation.",0
"68","A functional shooter with a sense of humor and a Batman license. It's got plenty to unlock, but it's not all that deep. Go, shoot, win. Over and over. If you're looking for a first-person shooter that doesn't take itself seriously, have at it, but don't expect a FPS revolution.",0
"69","The combination of the excellent community, unwavering focus on running the business, and the simplicity of the controls and your responsibilities creates a unique business simulation that rewards you proportionally to the amount of work you put into it.",0
"70","None of its individual parts is particularly original, but put together in the way they have been, you end up with a synergistic success of a puzzle title that will test both reflexes and noggin-scratching abilities.",0
"71","Though 2 Dawn did an admirable job of blending accessible vehicle-based combat with a few instances of more sophisticated mechanics, it feels like the game could have used more development time to smooth out the technical issues and, ideally, add in more weapons and combat options.",0
"72","Warriors Orochi 3 Hyper, while damaged in the shift from the other HD systems to the Wii U, ends up maintaining its appeal as one of this series' best installments.",0
"73","Despite its visual beauty and impressive execution, limited gameplay and general bugginess hold everything back. This beast has room to grow. When it does, expect great things. For now, a little turbulence makes for a bumpy ride.",0
"74","If you're a football obsessive or a stickler for the real thing, UEFA Euro 2012 is probably worth grafting onto your existing copy of FIFA 12. But for many, the same experience can easily be approximated by playing the game they already own with a through-ball from their imagination.",0
"75","Breathtaking to behold and controls beautifully, with well-designed levels and fun platforming. It's really too bad the experience is hampered by its unacceptably short length, as well as by the fact that the painting mechanic gets repetitive.",0
"76","If you haven't played FreakyForms before, this is probably the version to get, though the few improvements aren't enough to make the extra investment worthwhile for those who already own the downloadable version.",0
"77","The menus bury the coolest stuff, the touch controls are peculiarly particular, and even though the Vita is a connected device, I feel alone when I play this. If you're looking for a bright and colorful kart racer with good mechanics, ModNation Racers: Road Trip fits the bill, but it doesn't excel anywhere else.",0
"78","Like the other Michael Jackson games, Vita's first rhythm game suffers from a short setlist and only one real mode of play. It's a shame the experience ends in a tragic few hours, as dancing with your fingertips offers a special sort of enjoyment fitting for the King of Pop's best tracks.",0
"79","Army Corps of Hell has a great premise, some intense boss fights, and a fantastic soundtrack. Unfortunately, the repetitious gameplay bogs the experience down, making this a trip to hell that you're not going to want to keep returning to.",0
"80","A generally good experience, and a fun one most of the time, but its issues keep it from truly ascending to the heights of being Spectacular. Or Sensational. Or Astonishing.",0
"81","The issues themselves are a little more engaging than before, but the departure of quirky campaigns and beloved former presidents like Abraham Lincoln and JFK pose significant threats to its replayability. Without them, The Political Machine 2012 is a sober reminder of the problem that's plagued American politics almost since the beginning: at heart, it's still just the same old game.",0
"82","Its appeal is shortened by the ludicrous speed at which we can zip across it and grow tired of its lack of challenge.",0
"83","With strong visuals and convincing audio backing it up, I thoroughly enjoyed the time I spent inside my P-36 Hawk, and its generous free-to-play model never got in the way.",0
"84","Dual Destinies won’t change anybody’s minds about the series’ brand of narrative-heavy, gameplay-light adventuring, but longtime fans will be thrilled by the full docket of goofy legal twists and turns and fun characters.",0
"85","While I appreciate the world, atmosphere, and mechanics, I can't help but wish that there was a light at the end of Don't Starve's dark and lonely tunnel.",0
"86","The default game mode of Mario and Donkey Kong: Minis on the Move is little more than a Nintendo-themed reskin of the 25-year-old Pipe Mania, and frustrates with its randomness. The much better Puzzle Palace and Many Mini Mayhem modes, thankfully, leave us with a good game overall.",0
"87","It’s amazingly inventive and full of color and bright-eyed character, but its control problems are so persistent they’re unignorable.",0
"88","Its smaller levels, restrictive time limit, and floaty physics work well as a challenge mode add-on to an already terrific game. But as fun as it often is, this still feels more like an addendum to NSMBU – a remix, rather than something new that stands on its own.",0
"89","The bite-sized scope and limited choices available make me more interested to see what Shadowrun Returns will be a year from now, after the community has used the included mod tools to build on it, than in what it is today.",0
"90","In terms of story, dialogue, and encounter design, this add-on pales in comparison to the rest of Borderlands 2.",0
"91","Reus is a gorgeous-looking, imaginative game which suffers from over-baked mechanics, but those hungry for to play god are still likely to find one of their favourite Populous-style games in a long while.",0
"92","Arma III’s complexity is a double-edged sword. It takes a long time to comprehend, but once you’re comfortable enough with its mechanics to take advantage of them under pressure, you’re able to engage in a kind of large-scale tactical combat that’s simply not offered elsewhere.",0
"93","Neverwinter isn't a hardcore MMORPG, nor is it likely to compel you to cast aside your current favorite MMO to devote your full attention to it. But taken in small doses, it's a generally fun and free romp through one of fantasy's most beloved universes.",0
"94","The matchmaking system is straight-up broken, leading to frequent frustrating mismatches, and its four maps aren’t enough to keep me around for long.",0
"95","Miraculously miniscule price tag or not, Van Helsing is a damn (and probably damned) solid game.",0
"96","For better or worse, Freedom Cry feels like an entire Assassin's Creed game distilled into five hours. That’s good, but it’s an Assassin’s Creed game that doesn’t include many of the steps forward that Black Flag so recently made.",0
"97","Ikachan is disturbingly short, but the winning game design and charm might make the $4.99 download worth your time, especially if you’re a fan of Cave Story or Nicalis’ other work.",0
"98","Digital Extremes has created something that's often genuinely fun to play, and given the cost of entry, Warframe's well worth a try if you're in the mood for something different.",0
"99","Its slant on side quests and completionism did, at first, scratch an itch for me, but Doki soon suffers from its sheer repetition, especially because it lacks any sort of tangible challenge. Doki-Doki Universe began to stumble from exceptional to acceptable as the hours wore on.",0
"100","Played with a mouse and keyboard Spartan Assault becomes a much more enjoyable experience, better able to recreate classic moments of Halo brilliance, but it’s still limited by hit-and-miss mission design and fiction that takes the urgency out of this fight for survival.",0
"101","Though Burial at Sea Episode 1 may be a short vignette next to Infinite’s novel, it’s still one you aren’t likely to put down for the brief time it lasts -- and it’s priced accordingly at $15.",0
"102","A solid game, but one that feels like a testbed for something much better - once the designers have the guts to fully chart a new path instead of relying on tried and Aperture Science-tested concepts we’ve all already seen played out.",0
"103","Retrovirus successfully updates the little-used concept of 3D six-axis combat known best from Descent for contemporary audiences, but it suffers from insane difficulty spikes, a tendency toward repetition and a disjointed story.",0
"104","In the burgeoning sub-genre of physics-based, liquid platformers, Puddle is a game that only hits a little more than it misses.",0
"105","Thunder Wolves isn’t so much a wolf as a one-trick pony. And while that one trick – frantic, adrenaline-pumping action served with a healthy dose macho humor and feel-good firepower – is an exceptionally fun trick, it doesn't last long.",0
"106","Once you get the hang of it all, the strategic combat and its required pre-game build strategy and in-game adaptivity is fun, but don’t expect to master its tricky team-based combat and overwhelming upgrade system without a serious commitment.",0
"107","The Last Ranger comes up short as a sequel, as it spends too much time retreading the same territory we saw in the first game and addresses none of its flaws.",0
"108","A fun but short addition to the franchise. It's an acceptable substitute to the console experience, mostly on the strength of its interesting villain and original story. Just don't expect to get as much content out of this one as you'd get on the consoles.",0
"109","Despite the intriguing fighting-game veneer, the mechanics underneath are very standard, and there’s not much else here to compensate for that fact.",0
"110","The Jak and Daxter Collection’s three games are excellent, but if you have the ability to play them on the PS3 (or hell, even the PS2), then that's the way to go.",0
"111","As a game about family relationships The Novelist is interesting and relatable up to a point, but it doesn’t have a great deal of emotional depth, and the further you get into it the more you notice the flaws in its characterisation. Despite that, though, it’s worth a few hours of your time.",0
"112","Slender: The Arrival manages to deliver some truly impressive scares, but you’ll have to wade through the muck of repetitive tasks and unfair enemies in order to experience them. I found more enjoyment in playing the free original installment, which delivers a powerful horror experience without the annoyances and filler.",0
"113","A Murder of Ravens saves The Raven: Legacy of a Master Thief from going down in flames, but its narrative repetition and technical defects make for a turbulent ride.",0
