"","review","score"
"1","Despite the disappointing multiplayer options, the clichéd characters, and the sometimes repetitious nature of the campaign, the strategy gameplay of Shadow Wars is fun enough to make it a worthy recommendation for any turn-based enthusiast.",1
"2","Prejudice certainly does a lot – it just doesn't do very much well.",1
"3","While the timer on my save read around 14 hours by the time I screamed and shouted and pushed my way through Two Worlds II's final (miserable, cheap, and poorly designed) boss encounter, I would put my play time in the neighborhood of 35 hours, at least. This is courtesy of Two Worlds II's propensity to greet exploration with quick, brutal death.",1
"4","The[] ability to tear apart and repair the environments at will is a hook that keeps working, and when the campaign gives you plenty of stuff to tear apart it's easy to lose yourself to a primal need to destroy.",1
"5","It's funny, it clever, and it answers a lot of questions I had. I enjoyed playing it, but I didn't love it. The story isn't as grounded as I'd like it to be at certain points, so it throws the balance of sincere/goofy off. I wanted the conclusion of the serious movie feelings episode one started, but I got the comical ending of a Saturday morning cartoon.",1
"6","For a game that tries so hard to get under your skin, Fable III rarely manages to do much more than scratch the surface.",1
"7","Through questionable level design, graphical inconsistency, and repetitive gameplay, I was pulled out of the experience more than I would have liked. Alice: Madness Returns is a memorable peek through a flawed looking glass.",1
"8","With a level-headed team of four, Magicka's cooperative action is entrancing chaos. It's rare for a game to feel this mechanically satisfying.",1
"9","Serious Sam 3: BFE will ultimately exhaust its players by virtue of its screen-filling mega-confrontations, its non-stop repetition and the sense that you are almost always mercilessly outgunned. Sam 3 is good but could have been better.",1
"10","DCUO is far from a bad game; there are indeed times when it shines fantastically with the potential for greatness, but its many faults, most minor but some quite large, ensure that it never reaches those heights.",1
"11","A dungeon crawler with a boring loot table, poorly implemented multiplayer, and little lasting incentive to continue running around the world once the tedious story ends.",1
"12","I'm a fan of games that give you control of your character's life (see: buying houses, decorating, pimping sweet rides), but the driving is missing the raw energy it needs to stay interesting and the rest of the experience is bug-ridden.",1
"13","There's something kind of addictive about teaching your fake dog new tricks. For repeat customers, unless your kid is still playing the first game religiously, I don't see the upgraded version holding their interest for nearly as long.",1
"14","There's something kind of addictive about teaching your fake dog new tricks. For repeat customers, unless your kid is still playing the first game religiously, I don't see the upgraded version holding their interest for nearly as long.",1
"15","There's something kind of addictive about teaching your fake dog new tricks. For repeat customers, unless your kid is still playing the first game religiously, I don't see the upgraded version holding their interest for nearly as long.",1
"16","It's just disappointing that the developers only added a handful of mostly inconsequential extra modes in the interim, and didn't take that extra time available to fix a few of the first versions' flaws.",1
"17","For its effective use of 3D gameplay and its simple yet refined design, PilotWings deserves a good deal of credit.",1
"18","There's a lot of talking and gathering things for other people. It's rather ho-hum.",1
"19","Caught somewhere between massively-multiplayer online role-playing game and hardcore competitive real-time strategy, Age of Empires Online delivers some of the most addictive parts of both. Some sloppy mechanics and balance and reward issues detract from the core Age of Empires experience, but not to the point that it's not worth playing.",1
"20","Sanctum nicely upgrades Tower Defense genre but unfortunately doesn't dig much fun out of a good idea. [Issue#204]",1
"21","The lack of feedback, in-game competition, and unpredictability hurt the game's long-term draw; some older business simulations didn't have these problems. Cities in Motion does feature stellar tools and is one of the prettier business simulations on the market.",1
"22","An online shooter needs variety, depth, and addictiveness to succeed over the long term. Brink might find a niche with some hardcore fans, but it isn't for everyone. The PC version feels more complete than its console counterpart, but my qualms over content remain the same. Brink has heart, but the overall package is lacking.",1
"23","The majority of the new features introduced in The Sims 3: Generations are enjoyable enough to fiddle with, but none of them are major game changers.",1
"24","The content of Dead Money can get frustrating quickly. Still, for the patient souls out there, this fresh spin on Fallout is a decent buy.",1
"25","Sequence is sort of like serving someone a ham sandwich on a silver tray with all sorts of accoutrements. It's nice that it's a silver tray and not a paper plate, but I'm still eating a ham sandwich here.",1
"26","Homefront is certainly one of the most unique shooters I've ever played, driven by an ingenious and surprisingly well-fleshed out plot and a dark and dreary, realistic setting. But it also controls and feels like a typical shooter, looks like a game that's several years old, and most importantly, has an inexcusably brief campaign.",1
"27","Q.U.B.E. offers some short-term fun for puzzle fans and not a lot else. With so little emphasis put on story I can't help but feel that Q.U.B.E. may have benefitted from having no story elements at all, instead of loosely hinting at some bigger picture that goes unseen.",1
"28","Delivers an interesting and fun variation of a traditional card game and turns it into a competitive puzzle with myriad nuances to its strategy. Unfortunately, it doesn't do enough to keep the variation fresh throughout.",1
"29","And so it is that Freakyforms still leaves me scratching my head, even five months later. You're welcome to try it for yourself to see if you have better luck at understanding its madness, but I'd recommend most 3DS owners save the seven bucks to spend on surer bets.",1
"30","TwinBee is sort of fun and funny as it is.",1
"31","It's far from a perfect game -- inconsistent AI, a campaign that borders on the short side, and limited multiplayer options certainly hamper the experience -- but there's a lot of challenging satisfaction to be found beneath the thick jungle canopy.",1
"32","It all leaves me wondering why, at this point, anyone would choose to spend money on Play4Free when they could essentially get a larger, more complete game for just a few bucks more than the minimum Battlefunds purchase price.",1
"33","The flawed story mode can be safely passed by, but if you're able to find an opponent online or skirmish against the AI it's easier to appreciate Oil Rush's strengths.",1
"34","A surprisingly rich title for a handheld console. It's perfect for a quick game on tiresome commutes.",1
"35","I know a mediocre expansion when I see one, and this is a truly mediocre expansion, one not worth your money. Hold off until the price comes down or EA releases some sort of The Sims Medieval Gold Edition.",1
"36","In an age where everything is capable of online play, it just doesn't make sense for a franchise famous for its cooperative play to be single player only. Still, it'd be a great distraction for kids, who are less likely to be annoyed by the repetitive level design.",1
"37","Whereas the console version of Sonic Generations is a blending of old and new mentality in a fast-paced speed fest, the 3DS version is mostly just a Sonic Rush game where both playable characters happen to be Sonic.",1
"38","While it's admirable that the team had opted to create an original story set alongside the events in the books, you'll wish that they had attempted to take more risks with the project. The characters are bland and lifeless, and the combat, while fun at first, gets pretty repetitive before too long.",1
"39","It's like an interactive coloring book made by a 10 year old obsessed with Mastodon.",1
"40","A fun but deceptively shallow Sim-RPG-thing that would have benefitted from pushing the envelope for either genre a little more.",1
"41","The vast amount of customization options and the simple but fun battle system kept me interested enough to overlook the poor execution of story.",1
"42","Despite its considerable flaws, at its core, Mercenaries is a ton of fun. From the moment I started playing it I couldn't put it down.",1
"43","Cargo! The Quest for Gravity could have been an unforgettable game title; unfortunately, due to poorly-conceived vehicle controls, unclear objectives and some serious technical issues, what's bound to stick in your mind is the frustration of playing it.",1
"44","Sure, it's not very deep from an RPG-elements perspective, nor does it have the kind of story that's going to make you go ""Hm!"", but it will entertain you and help whet your appetite for the monster-stomping extravaganza that will be Serious Sam 3.",1
"45","The performance and control issues make Continuum Shift II a very disappointing package. If you're more interested in single-player, you might be able to tolerate the slowdown and enjoy BlazBlue's finer points, but I could only recommend doing so if you literally have no other options.",0
"46","Purchasing Arrival means there's more to do in Mass Effect 2, and that's always a good thing. It sets up the tone of urgency that's prevalent in the Mass Effect 3 trailer, but don't expect it to explain a lot. If you don't mind combat-focused, linear missions, it's worth the $7.",1
"47","Chantelise could have been a tight little RPG were it better balanced and not so keenly intent on punishing the player. With more grind than game, it quickly devolves into a pointless, repetitive drill that would test the patience of all but the most determined gamer.",1
"48","For the price it's not bad for being a multiplayer-only title, it's just that nothing about Breach is particularly noteworthy.",1
"49","The entire time I was playing, I felt ripped off. I'd been suckered into thinking I would be getting something new and dazzling and instead, I ran into the same problems I had 11years ago. Don't bother with this rehash on 3DS.",1
"50","It's odd blend of cover-based shooting, a fantasy setting, and hot co-op action make it an eyebrow-raiser, but the execution is flawed.",1
"51","E.Y.E. is an ambitious game from a small team, and has moments where it shines, but it ultimately isn't all that fun.",1
"52","If you don't expect much from it, you'll have a pretty good time with Venetica. However, without the patience to figure out quests and gameplay elements on your own, you'll end up incredibly frustrated.",1
"53","Innovative and somewhat unique but ultimately repetitive to the point of boredom and at times just plain annoying, Off-Road Drive, as it stands, simply isn't a good game.",1
"54","There's one hell of a game in there, trying to escape. And I think, given the responsiveness and the past track record of the development team and the plans that lie ahead in the next few months, that escape will soon occur.",1
"55","A $40 asking price for Pac-Man & Galaga Dimensions is far too high for such a mediocre collection.",1
"56","At this point, InMomentum isn't really worth its asking price. While its limited, nostalgia-tinged take on platform racing gets the entertainment wheels turning, its repetitive game modes and at times awkward mechanics prevent it from ever getting up to speed.",1
"57","F1 experts have probably already been racing their way through the home console versions of this title since September. With the 3DS version's odd A.I., it's hard to recommend that Formula fans give this edition a go. Codemasters knows racing -- but when they pass off portable development to other teams, you've got to be wary.",1
"58","The massive character customization also makes your faery or elf feel unique, so if you enjoy leveling up and finding loot, you should check out Faery: Legends of Avalon.",1
"59","Well executed, but lacking in depth (which is ironic for a multitude of reasons). However, once you give it a fair shot, you'll be surprised how addictive the gameplay is and how much fun you'll have trying to master the controls and conquer each mission.",1
"60","There is the skeleton of a good game in here: a multiplayer-focused Smash Bros clone starring Cartoon Network characters. But it's just too buried under poor controls and a mediocre single player campaign to achieve fun status.",0
"61","The First Templar is not good. Maybe with a bigger team, more time or a bigger budget this could have become something worthwhile, but it feels like an unpolished knock off.",0
"62","Aside from its uninspired combat and limited scope, Pirates of Black Cove is an endearing game at times. I wanted to love it, and kept diving back in hoping that something would click. It didn't.",1
"63","If simple fun and the inclusion of Pokemon is all you're looking for, then Rumble Blast is the game for you. Otherwise, there are much more deserving 3DS titles to spend your hard-earned cash on.",1
"64","Thor 3DS still offers a passable brawler for fans of the genre at its most basic, but if you're looking for the next great portable game, you best look elsewhere.",1
"65","With subpar platforming and boring level design, Rabbids is only fit for easily distracted youngsters or adults looking to throw away $40.",0
"66","An aesthetically gorgeous game with a really interesting premise that just never finds its legs.",1
"67","It's a muddled, hypocritical exercise in irritation with solid shooting mechanics and decent encounter design. There's some dumb fun to be had in Duke Nukem Forever, but the game tries hard to ensure it's only fleeting.",1
"68","I wouldn't call Jurassic Park a bad game as it works and does take us back to a time when dinosaurs (stiffly) roamed the Earth, but the story, animations and general gameplay keep it from being able to contend with most titles on the market -- and that includes other Telltale titles.",1
"69","Injecting dynamic time travel into a real-time strategy game is a risky, ambitious move. Though it takes a lot of effort, experimentation, and agonizing in order to use the time travel mechanics effectively, Hazardous Software manages to pull it off. The problem is the rest of the game suffers from design flaws and technical issues, making Achron feel like an RTS relic.",1
"70","A Game of Thrones: Genesis's sluggish campaign further suffers from poor pacing, and the end game almost always devolves into ham-fisted warfare punctuated by dull combat – one of its weakest facets.",1
"71","Despite its many shortcomings, Splinter Cell 3D is still fun to play. And that's what matters most. It's not even close to being as good as Chaos Theory on Xbox, but then again, I couldn't play that on a plane. If the AI were even passable and not laughable, this would be an easier recommendation.",1
"72","If a game's multiplayer mechanics are strong enough to support it, story isn't necessarily a must-have. Here however, awkward mechanics and skewed difficulty ultimately hamstring The Haunted: Hells Reach, and make you wish there was something more to hold it up.",1
"73","Cubic Ninja could have been an amazingly addictive game, but some faulty controls and a lack of content hold it back. It's still a fun experience, but for such a high price tag it's not really worth the investment.",1
"74","A poor change of pace for the franchise. Taking the story into modern times seems to have robbed it of its passion and charm, replacing it with asinine characters and more cuss words than an Al Pacino flick.",0
"75","Captain America fans should only buy this game if they're willing to put up with clunky gameplay and mediocre presentation.",1
"76","It's a step down from Shattered Dimensions, offering a less interesting plot, fewer Spider-Men to play as, and less fan service. As a finished product it just feels rushed.",1
"77","You need a clear, unified vision to shape a game into something that makes sense and compels the player to see it through to the end But scares and gameplay in Afterfall fall flat as scene after scene repeat the same notes, turning what could have been a spine-chilling adventure into a treadmill to an unsatisfying finish.",0
"78","The current game is broken, buggy, and not very fun. The plans for the future of Gods & Heroes are noble, but the core game needs to be reworked first and that could take far longer than it's worth.",0
"79","Killing the first few zombies in the tutorial level alone shows the violence and tactical planning that could have made the game something special. As you progress however, all the bugs, all the inconsistent controls, all the unbalanced gameplay, and the awful checkpoint system completely ruin the experience.",0
"80","The story is where the game had an advantage, but unfortunately it drops the ball with the weird narration, lack of dialogue, and limited cutscenes.",1
"81","I was most disturbed by the game's complete lack of multiplayer functionality, and the inexcusable state of its season mode, the two things that are the biggest draws in today's Madden franchise. It should go without saying that you should pass on this rushed iteration of Madden.",1
"82","While 1C Company should be congratulated for being ambitious enough to put forth the effort to recreate in minute detail, one of the most pivotal events of the Cold War, they should perhaps be admonished for not being ambitious enough.",1
"83","Bust-A-Move Universe has some serious negative sides (like being way too short and having no multiplayer), but the core gameplay is as solid as ever.",1
"84","Passion alone isn't enough to make a game great. Stronghold 3 assumes too much of the user initially, and doesn't do enough to keep the village-building fresh and interesting.",1
"85","There are many other 4X games on the market that do basically everything SotS2 intended, but better and without the bugs.",0
"86","I love the concept for Combat of Giants: Dinosaurs. It's brilliant. I wish the game lived up to that though. More varied gameplay, a longer career that got challenging, and multiplayer are all sorely missing.",1
"87","For the most part, the game is just boring with lackluster gameplay and reused environments, and then it gets frustrating. Toss in issues I didn't even mention such as unresponsive weapons and repetitive music, and I know I wouldn't want to suit up for this one.",0
"88","Truly horrible.",0
"89","The game lacks variety, but it also doesn't outstay its welcome. If you want some laughs and don't mind that the shooting experience is average at best, playing through this alien invasion is probably more entertaining than the movie and you'll get some Achievements/Trophies out of it.",1
"90","Skip over 3D Classics: Urban Champion. Urban Champion is not a classic, it never was, and 3D is entirely wasted on it.",0
"91","A ho-hum action game that despite its bang and bluster fails even to achieve mediocrity. It promises what looks like an interesting stealth/shooter mechanic but never lives up to it, settling instead for an approach that's linear and predictably formulaic.",0
"92","It is remarkable in its ability to make five minutes seem like five hours. Pickings might be slim on both the Wii and 3DS this summer, but Transformers Stealth Force Edition isn't diversion. It's abuse.",0
"93","It's hard to imagine anyone not being offended by Postal III. That's a big selling point for some folks, but the uninspired gameplay and serious technical glitches all but kill this dark, occasionally humorous, and extreme exercise in freedom of expression.",1
"94","For us, it's all about the sweet science, and in this regard SFxT is still sorely lacking.",1
"95","Something of an uncanny experience. A lot of the experience remains intact but its vitality has been drained away. It's a muted affair, and that ultimately harms a game that derives so much of its charm from those little touches.",1
"96","It's good, chaotic fun and has a baseline level of quality and polish that's pleasing to see. If this is your first Wipeout game, chances are you'll have a blast. For veterans, however – especially those schooled in the delights of HD and Fury – this game just isn't as smooth in feel or as elegant in design.",1
"97","Little Inferno looks nice, tells a unique story and will perhaps be seen by some as a triumph in experimental design. But it's not really a video game, so feel free to forget this freaky fireplace.",1
"98","So Fluidity: Spin Cycle feels like a hardware/gameplay mismatch on the 3DS, and the awkwardness of its controls keep it from ranking as one of the portable eShop's best purchases.",1
"99","ZombiU has so many great ideas from looting with the Wii U GamePad to permadeath to its spooky setting, but none of them grow into a great game. Controls are clunky, melee combat is annoying, and the game doesn't look good.",1
"100","Tera's an action-MMO that nails the ""action"" part and then manages a face-palm-inducing face-plant on all the other bits.",1
"101","There's still plenty of life in the genre, as this creative romp amply demonstrates, even if fully appreciating it takes more patience than some will be able to muster.",1
"102","Has a nice, colorful approach to golf and a respectable set of multiplayer options. But the disconnect between the amount of time required to plan a shot and the milliseconds needed to mess it all up sparks ample frustrations.",1
"103","Lilli's cute flavor of insanity makes her an intriguing character to play as, but she can't carry the plot of Harvey's New Eyes alone. The rest of the cast is so underdeveloped, the environments you explore so banal and uninteresting looking, that it's hard to appreciate Lilli's character or the smart puzzle design.",1
"104","It's impressive that Namco-Bandai has managed to port a full-sized, voice-acted Japanese RPG to the 3DS without sacrificing any of the content from the PlayStation 2 version. But it's also a six-year-old game that hasn't aged well in all respects, and if you're a North American Tales fan, it's likely to be one you've played before.",1
"105","It's hard to deny the value of buying a pool game on Vita and getting its PlayStation 3 counterpart as an added bonus. And graphically, Hustle Kings looks really nice. So despite the odd musical choices, spooky floating cue, bad connectivity, and annoying precision camera, Hustle Kings is still a good game.",1
"106","In light of its technical flaws, we'd only cautiously recommend buying it on Vita. If you own a PS3, Xbox 360 or Wii U, you'd be better off with any of those versions, while those seeking a fast-paced racer that really makes their Vita sing should consider WipEout 2048 ahead of this.",1
"107","More variety in the graphics and gameplay modes would have helped, but for those who want to listen to music on a long flight, for example, Symphony provides an excellent way to enhance that experience and get a little gaming satisfaction on the way.",1
"108","Supernatural doesn't augment your Sims or make the neighborhood more interesting: it turns it into an unrecognizable mess that doesn't even come close to resembling the ""life simulator"" it's supposed to be.",0
"109","There's just not much about Snapshot, graphically, gameplay-wise, or in any other way, that makes it stick out from the pack.",1
"110","The Secret World flirts with brilliance and – at least, during earlier zones – looks primed to seal the deal. But, as time goes on, its its seemingly bottomless bag of tricks starts to look a bit shallow.",1
"111","The real strength of When Vikings Attack is its humor. It doesn't take itself seriously, and provides a nice change of pace from the deluge of first-person shooters and bloody action games we're all becoming more accustomed to. But its gameplay won't hook you for more than a passing few hours.",1
"112","The idea of rotating orbits and fantastic aesthetics make Unstoppable Gorg feel striking and unique to start, but the rest of the game doesn't live up to that great first impression.",1
"113","War of the Roses isn't quite Mount and Blade or Battlefield, but it manages to walk a fine line between the two models to produce an innovative and enjoyable experience.",1
"114","The interplay between Horatio and Crispin as they push deeper into this pixelated robotic realm to recover their stolen goods is a high point in an adventure that feels like a bit of a slog despite its relatively short length.",1
"115","There's plenty to like about Retro City Rampage from its nods to our childhoods to its easy to get behind gameplay to its arcade mini-games, but the story -- the main hook of the title -- just doesn't stand up.",1
"116","A fine game that Mega Man fans will enjoy once or twice, but one without that special something that would allow it to rise to the greatness Mega Man so regularly reached in its heyday.",1
"117","The moves and kills you'd expect are here, but the story is boiled down to be easy to jump in and out of. That takes away some of the excitement in playing through it.",1
