"","review","score"
"653","Not having to lug around a portal to play it is incredibly convenient, on the other hand. It’s great to just tap your Skylander on the right thumbstick, like you would with an Amiibo, and have it be recognized by the hardware in a matter of seconds. This is our first chance to play Skylanders on the go, and this takes the the idea of being able to bring your Imaginators to your friends’ houses to adventure together to a whole new level.",1
"654","While it’s the weakest episode so far, More Than A Feeling still has some moments of payoff for leadership successes (and failures) earlier in the series.",1
"655","A very predictable update to a long-running series of dancing games that shines in visual design and unique choreography but is very loose with its tracking of your body movements. It’s not going to teach you to be a professional dancer, and it honestly doesn’t really teach you how to be good at Just Dance itself. That said, it’s still a whole lot of fun to play, and the songs that aren’t locked behind a paywall are varied and, largely, recognisable.",1
"656","Especially next to the first Mega Man Legacy Collection’s six games and nicer save system, The Mega Man Legacy Collection 2’s package of four included games is ultimately a step backward. While the games are mostly good, none of them top Mega Man 2 or 3 -- and for the record, I think 3 is the best. 8, 9, and 10 are worth revisiting for a dose of retro platforming challenge, but know what you’re up against going in.",1
"657","LEGO Worlds is commendable for its environmental diversity and the power of its creative tools to build anything you can dream of or manipulate every castle, hillside, and forest in sight. Unfortunately, fiddly menus, a pretty terrible combat system, and at times clunky and unfriendly construction controls weigh down on the wonder of finding and creating. Despite all this, I still find myself drawn back into it to discover what more the designers have hidden in the world-generation code, as coming across a massive ruined castle or an active volcano for the first time is always a treat - and an inspiration for what I want to build next.",1
"658","“Thicker Than Water,” other than its satisfying ending, is the season’s weakest episode yet. Little that precedes the action-packed conclusion feels like it has much, if any, weight to the ongoing story I’m invested in — namely Javi’s life and his relationships with Kate, Clem, and David. I’m absolutely on the hook for the season finale after that strong start and thrilling ending — I just wish everything before it hadn’t felt so thin.",1
"659","Slithering up simple structures in Snake Pass is one of the most mechanically satisfying video game ideas I’ve ever experience, and it effectively creates a sensation that feels the way maneuvering like a snake might. The camera and checkpoint systems aren’t great, but the concept still managed to hook me for the five hours it took wrap up the campaign. And in the end, I wanted to go back and replay stages to round up all the collectibles I missed.",1
"660","But where Telltale’s best adventures make you feel like your choices matter, ‘The Pact’ fails miserably in that department.",1
"661","Rebounding from a weak second episode, Batman: The Enemy Within’s third episode restores my hopes that this season will turn out well. Major developments around Batman’s big secret and strong interactions with Harley Quinn, Selina Kyle, and John make Fractured Mask work, right up until the extremely abrupt ending.",1
"662","Fighting my way through Ruiner felt like work, and if I weren’t obligated to finish it for the review I probably wouldn’t have bothered. It’s too bad it focuses on being difficult over being fun, because the combat totally works when you’re given access to the full range of weaponry and gadgets and can finally stand up to the nearly endless waves of varied enemies thrown at you. This one is definitely better the second time around. Games should be fun right from when you hit the start button – that’s kind of the whole point – but Ruiner puts you through too much of a hazing ritual to get there.",1
"663","Thanks to the imprecision of its shooting controls and the cheap behaviour of its AI, I could never really develop any confidence in Tokyo 42’s frustrating combat. Which is a shame because, glitches aside, I really loved exploring the wonderfully crafted world and the simple yet still challenging nature of its stealth-based assassinations.",1
"664","WRC 7 doesn’t unseat Codemasters’ Dirt 4 as this year’s premier rally game, but it definitely continues Kylotonn’s upward trajectory in the genre. It lacks the classic cars that consistently appear in other rally games and the career quickly runs out of puff, but it’s well worth playing to attack its excellent courses – especially its monster Epic Stages.",1
"665","Halo Wars 2 will scratch a real-time strategy itch and give you a dose of Halo-Universe flavor with a decent story, but it won’t go much deeper than that. A run-of-the-mill campaign, controls that hamper micromanagement, conspicuous bugs, and multiplayer that relies on luck limit its long-term appeal, but its fast and flashy action makes it fun for a while.",1
"666","Road Redemption’s combat is a good but short-lived bit of manic fun, but it didn’t offer enough to keep me engaged through the majority of the 13 hours I put into it, and I’m honestly not sure if that would change even with the addition of more to do.",1
"667","WRC 7 doesn’t unseat Codemasters’ Dirt 4 as this year’s premier rally game, but it definitely continues Kylotonn’s upward trajectory in the genre. It lacks the classic cars that consistently appear in other rally games and the career quickly runs out of puff, but it’s well worth playing to attack its excellent courses – especially its monster Epic Stages.",1
"668","The Signal From Tölva serves up a promising sci-fi concept, one that is made more intriguing by the ability to manipulate robot factions and some occasional awe-inspiring sights and sounds. But sometimes a slow burn can be a bit too slow thanks to its plodding movement speed, and that’s the case here. If you’re willing to wade through some deliberate pacing and lots of walking between repetitious shootouts with similar robot enemies, there are some intriguing bursts of action and sci-fi lore waiting for you on the hills of Tölva.",1
"669","The pacing is spot-on, the combat satisfying and the gameplay varied. Co-op is genuinely good fun too, and most definitely the best way for younger gamers to get into the action. Knack 2 is definitely a step up from the original, then, but until the writing and characterisation improve drastically, it’s not going to be a true first party titan.",1
"670","There’s not a lot of meat to Hey! Pikmin, which is disappointing when compared to the required skill and replayability of the console Pikmin games. It’s good for a playthrough, but this is a voyage I can’t see myself taking again.",1
"671","As you’d expect, the PC and PS4 Pro versions are the best looking versions of Snake Pass, with options for higher display resolutions and better lighting.",1
"672","Underneath a forgettable campaign and unimpressive AI, Tiny Metal houses the seed of a really deep and entertaining multiplayer wargame. But until a head-to-head mode is added, it’s not much more than a set of unchallenging training scenarios broken up by far too much overwrought dialogue. I had plenty of fun with it, but didn’t get the kind of edge-of-my-seat decision-making moments that turned the tide of a difficult battle I could find in similar games.",1
"673","A broad and goofy arsenal of unique weapons and gadgets and the ability to switch characters on the fly to access complementary abilities offers some solid combat and good mindless fun, but due to some unpolished writing and repetitive environments and enemy types, it doesn't fully live up to its heroic potential.",1
"674","Sure, it could’ve done so with a bit more subtlety – it's a bit heavy-handed at the very end – but at least Black does have a point to make. It’s just a shame that it wrapped that in a game that’s so shamelessly and distractingly derivative.",1
"675","Seven: The Days Long Gone feels like it’s trying to break new ground at every turn, but in the process it makes some really bad choices and is executed poorly. Its action is acrobatic but almost immediately gets stale, climbing is only fun when the levels allow it, most crafting systems are needlessly obtuse, and its fast-travel system actively tries to kill you on a regular basis. Add to that the regular bugs, and Seven’s days are numbered.",0
"676","Battlefront 2 does a lot of things right, offering a Star Wars experience that’s stunning to look at and wonderfully faithful to the source material, but it stumbles hard on the delivery. The campaign is amusing but scatterbrained, and worse, in multiplayer the randomized progression systems are downright hostile toward its players. EA has already made two big adjustments to this system in the week leading up to launch alone, and we can only hope that more significant changes are on the way. But right now, the Star Cards system’s frustrating progression is actively driving me away from the multiplayer battles.",1
"677","The core of Episode 5: Don’t Stop Believin’ provides a thrilling and fulfilling resolution to the season arc with a couple interesting surprises in store. I just wish it hadn’t been immersed in this flimsy, fake crisis of the Guardians breaking up and getting back together that was never fully realized, and ended up dragging the whole season down.",1
"678","Ultimately, FIFA 18 on Switch is a story of what could have been. Watered-down game modes give the whole experience a feeling of it being a work-in-progress rather than the complete package offered in the PS4 and Xbox One version. If you only want a quick FIFA fix in single-player or local play, the Switch version delivers. But it’s such a diluted, Sunday League experience it’s impossible to recommend if you’re already playing on home consoles.",1
"679","When The Long Journey Home focuses on interactions with a diverse and entertaining cast of aliens across its procedurally generated star systems, it's possible to find a degree of wonder and personality that many roguelike seldom achieve. Unfortunately, such interactions take a back seat to a barrage of frustrating minigames with rewards that rarely match the risks. The experience as a whole suffers for it.",1
"680","Under the better-than-ever graphics and great-as-ever core wrestling gameplay, WWE 2K18 is a largely disappointing iteration. It wastes too much of its ambition on the poorly written and dull MyCareer RPG mode, leaving its other promising modes to languish for another year. What few enhancements we get to the carry mechanics and eight-person matches are welcome, but not as much of a year-over-year refresh as would be needed to keep the excitement level as high as it’s been in past years.",1
"681","But where Telltale’s best adventures make you feel like your choices matter, ‘The Pact’ fails miserably in that department.",1
"682","The best-case scenario for ELEX is that it’ll be worth picking up on sale a year or two from now after it’s been heavily patched to fix its rampant bugs and infuriating balance problems. It has enough good ideas that one day it might be talked about as one of those hidden RPG gems that people play and wonder why it wasn’t successful at launch. But the frothy mix of joy and frustration that ELEX presents today skews too heavily toward the latter.",0
"683","Battlefront 2 does a lot of things right, offering a Star Wars experience that’s stunning to look at and wonderfully faithful to the source material, but it stumbles hard on the delivery. The campaign is amusing but scatterbrained, and worse, in multiplayer the randomized progression systems are downright hostile toward its players. EA has already made two big adjustments to this system in the week leading up to launch alone, and we can only hope that more significant changes are on the way. But right now, the Star Cards system’s frustrating progression is actively driving me away from the multiplayer battles.",1
"684","Under the better-than-ever graphics and great-as-ever core wrestling gameplay, WWE 2K18 is a largely disappointing iteration. It wastes too much of its ambition on the poorly written and dull MyCareer RPG mode, leaving its other promising modes to languish for another year. What few enhancements we get to the carry mechanics and eight-person matches are welcome, but not as much of a year-over-year refresh as would be needed to keep the excitement level as high as it’s been in past years.",1
"685","The Sims 4 on console includes all the free feature updates from the PC version, and while they are good new additions that should have been included with The Sims 4 to begin with, they don’t make up for the performance issues. Most of the problems are minor annoyances, but because save and menu bugs have been so frequent, this version of The Sims 4 is a generally unreliable experience, which is unfortunate since it is a genuinely fun game. And while it is disappointing that the console version is missing some community features from the PC version, I’m glad that at least cheats work.",1
"686","Sure, it could’ve done so with a bit more subtlety – it's a bit heavy-handed at the very end – but at least Black does have a point to make. It’s just a shame that it wrapped that in a game that’s so shamelessly and distractingly derivative.",1
"687","Berserk and the Band of the Hawk is mindlessly repetitive, but its combat is still somehow addictive enough to be an enjoyable action game with a dark-fantasy story that stays true to its source, most suitable for fans of Berserk. It even left me craving to try out new characters in Endless Abyss Mode. But it desperately needs more challenge and variety to carry it through its campaign, especially considering you can’t bring a friend with you.",1
"688","Kylotonn has dredged this near-forgotten racing rebel from the very bottom of the barrel and fashioned it into a basic but fun, stunt-filled speedster, but I found myself regularly frustrated with its repetitive career mode, its stingy economy and nebulous unlockables, its superficial demolition derby events, and its uneven difficulty. A respectable franchise rescue mission but one that still needs some fine tuning and some extra grunt.",1
"689","Rain World is a maddening thing, because of quite how special it could have been. Beautiful environments, incredible animations and enticingly hazy mechanics are fantastic, but the sheer cruelty of how it’s pieced out to the player transcends challenge and becomes an unwanted trial.",1
"690","The Sims 4 on console includes all the free feature updates from the PC version, and while they are good new additions that should have been included with The Sims 4 to begin with, they don’t make up for the performance issues. Most of the problems are minor annoyances, but because save and menu bugs have been so frequent, this version of The Sims 4 is a generally unreliable experience, which is unfortunate since it is a genuinely fun game. And while it is disappointing that the console version is missing some community features from the PC version, I’m glad that at least cheats work.",1
"691","NBA Playgrounds isn’t as deep as NBA Street or as beautifully simple as NBA Jam, but the gameplay is still well paced and the controls are still tight. It mixes this gameplay with cartoonish qualities and a retro style that fits an arcade basketball game, and earning new packs of random players is always rewarding. That said, I’ve taken some bad beats from the random power-ups system, and the online options are slimmer than I’d like.",1
"692","Mr. Shifty is an okay brawler that uses a stylish warping ability as a cool way to get the drop on unsuspecting foes. While it’s fun to smack down security goons with quick melee skills, the horrible framerate of the final act will test your patience. If you do endure and manage to drop the final boss, Mr. Shifty doesn’t present enough reasons to replay it.",1
"693","Battlefront 2 does a lot of things right, offering a Star Wars experience that’s stunning to look at and wonderfully faithful to the source material, but it stumbles hard on the delivery. The campaign is amusing but scatterbrained, and worse, in multiplayer the randomized progression systems are downright hostile toward its players. EA has already made two big adjustments to this system in the week leading up to launch alone, and we can only hope that more significant changes are on the way. But right now, the Star Cards system’s frustrating progression is actively driving me away from the multiplayer battles.",1
"694","It’s worth a look for Burnout veterans, as long as you calibrate your expectations appropriately.",1
"695","When it works, Strafe is a generally entertaining retro-styled shooter that mixes procedurally generated levels into an experience strongly reminiscent of Quake. It's a great concept that usually comes together, but between the quirks of randomization, powerful enemies that run almost completely silent, lethal bugs, and hefty costs for vital armor and ammo powerups, a lot of the time it feels as challenging as rolling the dice and coming up with double sixes.",1
"696","It’s all such a disappointment. I very much wanted to like Lucky, because the Xbox could use a decent answer to Nintendo in the 3D platformer genre. Unfortunately, Super Lucky’s Tale definitely isn’t it.",1
"697","A broad and goofy arsenal of unique weapons and gadgets and the ability to switch characters on the fly to access complementary abilities offers some solid combat and good mindless fun, but due to some unpolished writing and repetitive environments and enemy types, it doesn't fully live up to its heroic potential.",1
"698","Impressive in some areas and disappointing in others, Bomberman's Switch debut is a bit too pricey to recommend.",1
"699","There are already so many different ways to play Minecraft, and the 3DS version fails to live up to the standards set by the other versions. It’s not a bad slice of pizza, but there are so many better choices.",1
"700","Kylotonn has dredged this near-forgotten racing rebel from the very bottom of the barrel and fashioned it into a basic but fun, stunt-filled speedster, but I found myself regularly frustrated with its repetitive career mode, its stingy economy and nebulous unlockables, its superficial demolition derby events, and its uneven difficulty. A respectable franchise rescue mission but one that still needs some fine tuning and some extra grunt.",1
"701","Urban Empire's premise of focusing on the political tumult that's usually behind city planning is a good one, and the emphasis on four families allows for some lightweight roleplay in how you guide your city to greatness. Unfortunately, the personal approach tends to stumble as each game more or less plays out like the last, and the constant juggle of votes makes for an experience that's more exasperating than exciting.",1
"702","When you’re playing as Jason, this is unquestionably the best Friday the 13th game ever made. I really appreciate the genuine love for the franchise on display here. Hunting down players and executing them in spectacularly gory scenes is an homage that warms my lifelong Friday-fan heart. But the fun of its asymmetrical multiplayer-only action is heavily skewed toward Jason, which means you’ll mostly be stuck playing as teens rummaging through drawers.",1
"703","Curse of Osiris landed in Destiny 2 with a thud. Its campaign and story are a bust, its new content is mixed and buggy at best, and it does nothing to address the community’s loud cries for fixes to the endgame. The few redeeming features are its more challenging and varied Adventures, and the Raid Lair’s puzzles and tough boss battle.",1
"704","Eventually, though, the heavy emphasis on the luck of level generation, the frustrations of enemy repetition, the poor tutorial, and the tendency to overrun you with tough enemies spoil the whole. Hard games are great, but there are limits.",1
"705","Perception is as much a disappointment for the clever and inherently frightening idea it wastes as it is for the mistakes it makes. At its heart, there’s the promise of playing something genuinely new, from a perspective that could help teach and thrill simultaneously. It’s unfortunate that, like its echolocation mechanic, the more I saw of Perception, the more there was to worry about.",0
"706","Need for Speed Payback is a big, competent, and confident arcade racer but it’s really let down by its linear cop chases, its overwrought and insidious upgrade system, its dreadful dialogue, and its superficial action sequences. It feels fine and it looks flashy, but Payback really went all-in on its direct-to-DVD revenge tale and it was a bust for me.",1
"707","Rain World is a maddening thing, because of quite how special it could have been. Beautiful environments, incredible animations and enticingly hazy mechanics are fantastic, but the sheer cruelty of how it’s pieced out to the player transcends challenge and becomes an unwanted trial.",1
"708","1-2-Switch is a successful demonstration of unique hardware, but a shallow, gimmicky game.",1
"709","On top of the joy of creating and playing as your own character, there’s a lot of goofy charm that makes Sonic Forces hard to be too disappointed with. The graphics are colorful and engaging, and the music is a pumping backdrop for extreme team-ups, super-speed cinematics, and lots of ruminations on the power of friendship. There are some really fun levels in the mix, too, and surprisingly strong boss fights make for some unexpected highlights. But Sonic Forces doesn’t build on its handful of good ideas as much as it should, and it screeches to a halt just as it seems to hit its stride.",1
"710","Curse of Osiris landed in Destiny 2 with a thud. Its campaign and story are a bust, its new content is mixed and buggy at best, and it does nothing to address the community’s loud cries for fixes to the endgame. The few redeeming features are its more challenging and varied Adventures, and the Raid Lair’s puzzles and tough boss battle.",1
"711","Curse of Osiris landed in Destiny 2 with a thud. Its campaign and story are a bust, its new content is mixed and buggy at best, and it does nothing to address the community’s loud cries for fixes to the endgame. The few redeeming features are its more challenging and varied Adventures, and the Raid Lair’s puzzles and tough boss battle.",1
"712","Perception is as much a disappointment for the clever and inherently frightening idea it wastes as it is for the mistakes it makes. At its heart, there’s the promise of playing something genuinely new, from a perspective that could help teach and thrill simultaneously. It’s unfortunate that, like its echolocation mechanic, the more I saw of Perception, the more there was to worry about.",0
"713","The very basic golf gameplay is full of frustrating moments without high points to balance them out, the graphics are rudimentary without stylistic charm, and the jokes in the goofy story and commentary don’t land often enough to save it.",1
"714","With a look this distinctive, Drawn to Death could have hit the ground running. But as a decent shooter it merely limps, thanks to a number of unfortunate design choices, a lack of options, and rampant bugs. Intricate levels, varied weapons and unique characters may have looked good on paper, but any positives Drawn to Death has get scribbled over and obscured by the constant barrage of un-funny abuse it insists on endlessly spewing in your face.",0
"715","Perception is as much a disappointment for the clever and inherently frightening idea it wastes as it is for the mistakes it makes. At its heart, there’s the promise of playing something genuinely new, from a perspective that could help teach and thrill simultaneously. It’s unfortunate that, like its echolocation mechanic, the more I saw of Perception, the more there was to worry about.",0
"716","Valkyria Revolution tells a decent tale of war, but the strength of that story is dulled by overlong, boring, and poorly animated cutscenes.",1
"717","Sniper: Ghost Warrior 3 is by no means a great game, though its value is raised by short and varied missions, fun action elements, and an ability to make me feel like a legit action hero. Regardless of how much it borrows from other games, I can’t deny that I had a good time blowing through missions and enemy troops. However, the poor graphics and technical issues like long loading times and crashes occasionally ruined the fun. And, minus any sort of multiplayer, there’s not a lot of reason to go back.",1
"718","Valkyria Revolution tells a decent tale of war, but the strength of that story is dulled by overlong, boring, and poorly animated cutscenes. It sacrifices the unique historical setting and art style of the Valkyria Chronicles series proper in favor of generic JRPG elements that fail to leave a strong impression, and its hack-and-slash combat offers little in the way of strategy and ruins its own flow with an poorly matched magic system.",1
